Label,Sentence
0,떤 기술적으로도 철학적으로도 계속
0,취업하고 싶은 분야가 어떤 분야 였지 
0,아 진짜 
0,못 안 보이거든 눈을 못 뜨는 상탠데
0,하고 싶은 마음에 들면 하지 않을까 
0,거기에서는 좀
0,이 타고난 거는 어쩔 수가 없나 봐 
0,두 개 다 있는 것도 있고 그
0, 학년 때부터 이 이쪽 꿈을 가졌었는데
0,그 막 페이스북 같이 에스엔에스에도 많이 사진 올라오고
0,아니면은 혼자만 알고 있을 거야 
0,그 편의를 굉장히
0,잘 활용해서
0,어디냐 신사 가면
0,가볍게 하는 거지 나도 이번에 수강권 등록하면서
0,그리고 엄마가 헬멧을 안 썼던 이유는 헬멧에는 앞에 챙이 없어 
0,약간 눈치 보는 느낌 
0,제주도 갔을 때에도
0,아 뭐 아기 키우고 바쁘니깐 못 하는 거겠지 이러고 넘어간다 
0,아이들한테 있어서 만큼도
0,티켓팅 성공했어 
0,너무 하신 거 같다 
0,유통과정 뭐 뭐 영업 쪽이라든지
0,눈 깜빡 하니까 끝나 있는 거야 
0,쪼금 어색해 하시는 부분이 있는 것 같아 그 셀프웨딩을 하면
0,아 무섭다 갑자기 와 가지고
0,난 그런 쪽은 반대인 거 같아 
0,코로나 때문에 에이아이가 나와서 사람들이 더 편하게 이용한 부분은 나도 맞다고 생각하거든 
0,살아갈 수 있는 거
0,음 그래 좋다 
0,정말 그것보다 더 싫은 것 중에 하난 또 부동산 규제 같은 문제를 있거든 
0,신랑도 마음이 약해서 거기에 대해서 말 하지 말라고 하더라고 
0,좋은 인연도 많이 만나고 있어 가지고
0,저기 뭐야 통학 버스에서도 확진자 나와서
0,또 에스지 워너비 노래가
0,그래서 찾아보니까 더 가고 싶어졌어 
0,뭐 걱 그러니까 마음 졸이고
0,그 고통을 자신이 이겨 내지 못해서
0,근데 에이아이가 이제 직업을 대체하게 된다면은
0,학교 가는 것을 인제 더 싫어해요 
0,이런 것도 진짜 되게 많아졌잖아 
0,아 라우브 하면
0,어떤 가수의 플레이 리스트 한 시간짜리
0,별로 결혼에 대해서 딱히 생각이 없더라고
0,나도 비슷한 거 같아요 그 전에는 막 아침부터 만나서 밤 늦게
0,예 저는 개인적으로 술은 먹지 않고 좋 좋아하진 않지만
0,그리고 요즘에 기차도 무궁화호도 있고 에스알티라든지 뭐 케이티엑스도 되게 다양하게 많잖아요 
0,너무 너무 잘 알아 
0,아직은 얼마 안 돼서 뭐 이제 유명했던 디피랑
0,정말로 내가 원하는 걸 못 하게 되는 거지 
0,늘 사람들이
0,자기 사생활 침해를 한다거나
0,그다음에 호날두가 다시 유벤투스에서
0,너네는 약간 대한민국이 민주주의 사회니까
0,반대로 반대로는 이제
0,한 달 칩거한 것에 대해 어떻게들 생각하십니까 
0,허 근데 니 결혼 했었네 
0,너는 지금 주식 한 지 오래 됐잖아 
0,그러면서 아 진짜 더 본이 되는 행동을 많이 해야
0,안 할 순 없으니까 만 원짜리로
0,뭔가 대성당이라든가
0,막 뭐 물어 뜯을 거 다 물어 뜯고
0,맞아 진짜 나이가 들면 들수록 이제 근력 같은 게 많이 떨어지고 하니까
0,이제 다시 배워 보고 싶어 형도 혹시 보드 타 본 적 있어 
0,그 팀 어 박지성 있었던 그 팀 기억나니 
0,되게 그 나이치고는 깨어 있으신 분이라 
0,그것도 괜찮고
0,대면 수업만 계속 하는 거는
0,그냥 면접 보고
0,계단 형식으로 된 게 없잖아 
0,아니 아직 올리지는 않았고 원본 파일만 이메일로 받았어 
0,왜 여러가지 음식을 먹겠어 뭐 채소도 고기도 먹고
0,좋을 거 같은데 박 일 아니더라도
0,집들이 한 번 쯤은 괜찮지 
0,큰 사고는 이거 두 개 밖에 없었고
0,그리고 우리가 단적으로 막을 수도 있다라고 나는 생각이 들거든 
0,그런 거를 한다면 어떨 것 같아 
0,그래도 좀 기쁘게 지내려고 하는 편이긴 하고
0,나는 한번 해 볼 수 있다고 생각해 
0,아 그런 효과도 있지 
0,부서나 그런 쪽으로 많이
0,스트레스를 받을 때마다 또 사람들은 스트레스를
0,이거는 근데 계약 기간이 좀 짧아 
0,그때는 진짜 부산에서는 혼잡하다고 느꼈었는데
0,그런 거 비슷한 것처럼 좀 혜택이 가격을 좀
0, 주 전에도 샀거든 
0,사회생활하면서 이 언니가 너무 괜찮은 거야 
0,그런 좀 어두운 분위기의 드라마를
0,최근에 보신
0,몇 명이나 몇 명하고 연락하고 다녀 
0,좀 더 신뢰성 있는 곳을 알아 가고
0,뭔가 거기서 그 미국인들이 어떻게 생활하는지도 보고 싶어
0,그런 좌석 버스가 대부분은
0,후기를 많이 읽는데 되게 이제 좀 그랬던 게 뭐 엑스라지
0,그런 전기 사용에 있어서
0,대학교 다니면서
0,그런 부분의 문제이기 때문에
0,그런 경우에 있을 때 내가 나가게 되면 항상 차를 타고 나가게 되는데
0,부동산이나 사실 종목선정
0,진짜 빨리 가서
0,식당 같은 데는 출입이 안 되겠다고 하고
0,여고에 진학하다 보니까
0,그 나 집에 안 들어온다고
0,아예 무조건
0,이게 사람 특성마다 다른 것 같은데
0,밝히기 좀 애매한 거 같아요 
0,응 오빠 말이 맞아 
0,막 앨범 버전별로 다 사고 콘서트 가고
0,오늘 크게 금액대가 많지 않아 그래서
0,내가 뭘 하는지 모르고
0,응 너무 예쁜데 노래도 잘 부르니까
0,어 음악적 성향이 굉장히 달라서 어 그런
0,공기계가 얼만데 
0,근데 최저 임금 올라가니까
0,에이아이가 감당을 할 수 있을까 그거를
0,그만큼 사실 수술을 받는 입장에서는 많이
0,자기 좋고 따지지 않고
0,그러지 않아 
0,습득을 하다 보니까
0,그래 엄마가 그 성격은 알아 
0,이제 다 일하니까 뭔가
0,저 하시는 분 있었다고 얘기하면은
0,그 대학 책
0,솔직히 울산에 뭐 그다지 갈 데가 없으니까 맨날 가는 데만 가고 버스 빨리
0,또 이렇게 사 가 와서 빨리 데워서 먹고
0,특히 이제 친정 쪽도 많겠죠 시댁 쪽은 한 번씩은 보겠지마는
0,너무 칭찬을 하면서
0,이런 거 많고 빵 많고
0,그런 근무 환경 이런 게 좋지 않으면은
0,나도 그렇더라고 그래서
0,가서 물어보자 
0,에스파 알 것 아니야 
0,몸이 안 아파야 할 텐데
0,남자가 응 예능을 전공해서 취업하고
0,그런 거 영업을 한다고 하더라고
0,진짜 많이 땄었는데 그거를 코인에 다 잃어서
0,그냥 뭐
0,같이 부르면서 놀았던 기억이 나네 
0,더 공정성 있는 이제 재판이 되지 않을까 
0,결국 자기 이야기들
0,아무래도 뭐 막 좀 순수하거나
0,그 팝송 듣는다고 했잖아 
0,있는데 그게 언제냐 
0,근데 그 답례품이 쓸게 없고 싸구려 인거지
0,너 갈 때 나 따라 가고 싶다
0,중독되는 경향이 있는 거 같아 
0,그냥 언제나
0,그 유희열
0,그래서 저상 버스는 되게 좋더라고 
0,무슨 주제를 바꿔 
0,그나마 좀
0,왜냐하면 그냥 우리
0,코바늘 그리고 실 같은 거 파는 대형 매장 있거든 
0,어 자연을 더 많이
0,사람 몸에 정신에
0,좀 보기 싫은 그런 것도 있더라고 근데
0,지금 별로 투자 대비 전력 발전에 대한 효율이
0,어 참는 거 중요하죠 
0,얘가 되게
0,티브이로 티브이엔 굉굉장히 익숙하지만
0,청년 인턴을
0,되게 뭐라 할까 
0,그거 게임
0,나도 되게
0,뭐가 있냐면
0,네 전신 운동일 뿐더러 
0,그냥 엄마만 좀 불안해 가지고
0,그거 떨어져 가지고
0,막 절하고 그랬는데 그 풍속이
0,교수가 되는 꿈을 버리지 않고 일단은
0,어 나는 근데 내가 워낙 길을 잘 못 찾아 가지고
0,새로 난다는 거 같던데 
0,치즈나 파스타 이런 음식들은 잘 먹어
0,그런 애들이 진짜 귀여운 거 같아
0,더 좋은 기회가 되는 거 같아 그렇게 생각을 하고 나니까
0,맞아 맞아
0,그것도 이제 부정 할 수가 없는 말이 되어 버려 좀 그렇더라고 나는 
0,내 선생님이 추천해 주고 선생님이 사주셔서 더 맛있게 먹었던 거 같아요 
0,선수들이 솔직히
0,따기 싫어서 안 따기보다는
0,그런 건 내가 낯을 많이 가려서 그런가 
0,상대방을 마음 편히 대할 때에
0,학교 안에서 하는 게 아니라 그 앞에 술집 거리에서 하는 거잖아 
0,근데 그건 어쩔 수 없는 거 같아 
1,아빠 나도 간지러워요
1,밤에 일찍 자고
1,자 책 갖고 왔나요
1,하얀 소금 아이 짜다 짜
1,어떻게 했어
1,아이 접시가 모두 비었어요 저런저런 누구 입에 스프가 묻었네요
1,응 그렇게 하고 있어
1,숲 속 친구들이 너를 위해 소중한 선물을 준비했단다
1,중간 중간에 심는 게 철근이야 쇠로 된 거 두꺼운 철근
1,비가 너무 많이 오면 막 집도 떠내려가고 막 그러잖아
1,종현아 이거 볼까 엄마랑 어
1,별 별 반짝반짝 별이야 이게 별이에요
1,또 뭐 끝났네
1,토끼 아이스크림 먹으러 가나봐
1,엄마는 여기 좀 앉아야겠어 어제 잠을 너무 못 잤더니 힘들다
1,그리고는 다람이가 아기 토끼한테 동생을 보여주겠다고
1,으응 그렇게 감어
1,그래서 지금 밤인데 놀이터에 사람이 있어 없어
1,그러면 진이는 어디가 이쁘게 생겼어
1,더 깊은 연못에 독이 들어 있어요
1,어 엄마도 만들었어
1,이렇게 되야지 엑스표야
1,아니야 내가 이따가 저녁에 다시 전화할게
1,응아 응아
1,네 개가 남았네
1,이거 인형도 해봐
1,이 자 다들 손잡고 춤을 추는데요 시마지로는 춤을 안 춰요
1,저를 육지로 보내서 제가 간을
1,공룡은 저기 꽃 있는데다가 옮겨 줄까
1,빠 바
1,이거는 꿀꿀꿀꿀꿀꿀꿀꿀 돼지다
1,응 다 쏟아놓으면 먼지대왕이 어떻게 해
1,아빠 숫자 알어
1,응 찐 내꺼야
1,그렇지 공항에 가 가지고 비행기 타는 거지
1,브라질이나 파라과이 콜롬비아 이런 데서 많이 수확을 한대
1,또 들어갔어
1,어떤 맘마
1,어 잘했어
1,이거 그냥 손으로 뜯어봐 이런 건
1,우와 놀이터에 놀러갔나봐
1,아이 예뻐
1,짠 시마지로하고 시마지로 엄마하고 애기하고 밖에 나갔어요
1,화분도 집 안으로 들여놔야겠군
1,그런데 천사들이 아기가 태어나려고 그러니까
1,아이고 우리 세윤이 착하구나 그러면서 꼭 말해야지
1,어디 앉을 꺼야
1,저기로 가 저기로 가 어디로 갈까
1,아 그랬어
1,우유 주세요 그래 봐
1,소방차를 막 타고 위용위용위용위용
1,쥬스 거기 놀라구
1,어떻게 하는 거야 이거
1,아 이게 이름아 봐 봐
1,토끼 삼총사가
1,아기가 울자 곰돌이도 눈물이 나려고 했어요
1,또 여기 도토리 어디 있어
1,해 봐 이름이가 자
1,위용위용하면 다른 차들이 어떻게 해줘
1,그리고 신나게 줄넘기도 했답니다
1,잡고 싶지
1,어 이 친구는 해바라기인가봐
1,내가 혼내줘야겠어 하고 곰돌이 괴물이 소리쳤어요
1,캘리포니아 콘도르라는데 새래
1,여기 여기 이렇게 이렇게 된데 잘 봐
1,기저귀 벗자
1,예쁜 언니 이거 뭐에요
1,그럼 이게 뭐야 무슨 내용인데
1,컵 케이크
1,응 첫발견 시리즈가 유수의 세계의 유수한 언론이 보내는 찬사
1,어 으
1,자 꽃을 이렇게 꺾었어
1,엄마 책
1,이거 봐 앞발이 굉장히 짧고 조그만 하잖아
1,여기는 부엌이다 부엌
1,자 이거인가보다
1,애는 고기
1,우와 민들레 꽃이다 재미있는 풀잎 미끄럼틀이야 우와 팔랑팔랑 팔랑나비네
1,응 이게 이 고 이건 삼
1,응 뭐가 된다고
1,할 수 있을까 없을까
1,애는 홍합 애는 사랑앵무 애는 매
1,왜 뭐가 또 필요하세요
1,오늘 밤에 친구들한테
1,자 통통이와 영은 사이가 좋은 친구였어요
1,거기서 가만히 안 있고 돌아다니면 엄마를
1,여기는 터널이에요 터널에서 뭐가 나와요
1,천천히 천천히 그렇게 달리고 있네
1,그래 이거 뽐내기 대장 하니발 읽어줄까
1,여우도 있네 여우도 있고 팬더도 있고 이름 좋아하는 거 많다
1,이거 한 번 읽을까
1,응 저건 뭐니
1,예루살렘이 아니구나
1,그러나 빨간 모자는 아무 것도 몰랐습니다
1,아이구 잘 하네
1,애들아 이리로 와 봐 보여줄께 있어
1,에이 안되겠다
1,이게 뭐야 머리카락이 있네
1,아이 좋아요
1,그것도 오백 원짜리
1,떼 달라고 잠깐만요 이 월 오늘이 십 며칠이지
1,엄마 여우
1,안 아파
1,되게 높은데 이지윤이 왔어
1,어떻게 태우지
1,이게 뭐지
1,그리고 우리는 세모별에 가는 길이잖아
1,아빠 나도 간지러워요
1,고추통이 있어
1,이름아 구슬 몇 개야
1,미끄럼틀 가십니까
1,아이 예쁘다
1,문 닫았어
1,통통이와 영은 사이 좋은 친구
1,엄마가 요기 올려 놓을께
1,고슴도치는 겨울 잠을 자기 위한 장소로
1,거북이가 빨리 갔게 토끼가 빨리 갔게
1,스키 타다가 아이고 넘어졌어요 그렇지요
1,오 말미잘이에요
1,이거 뭐야 이게 뭐야
1,강아지 해 봐
1,응 기린 붙여줘
1,뭐 있어
1,떨어진 거
1,이거 먼저 해 줄까
1,또 무슨 책이 있을까 이름이가 좋아할 게
1,응 벌레한테 물려서 다 죽였어 그치
1,칙칙칙칙칙칙칙칙칙칙 칙칙칙칙칙칙칙칙칙칙
1,그럼 우리 뭐할까
1,또 반대편은 이렇게 더워 아 덥다 아 덥다
1,안 되지
1,어 이거 봐
1,누가 무거워
1,잠깐만 엄마 요거 봐 봐
1,개구리가 팔짝 개구리가 어떻게 뛰어다녀요
1,이제 그만 할까
1,아빠 목 말라요 우유 주세요 했어
1,그리고 밤에 잠을 잘 자야 돼
1,그렇지 써야 되지
1,넘겨 보자
1,자 쿠키 과자 찾으래
1,자동차 사고가 났나
1,자 여기
1,어 쟤 누구야 인형
1,구리구리 멍텅구리 가위 바위 가위 바위 보
1,아풍 사자
1,그거 가지고 와봐 종현이가
1,응 찐 요기 있어
1,돼지 가족 뒤에 이 트럭 뒤에 잔뜩 실려 있는 초록색 물건이 뭘까
1,이름이 들어 봐
1,저기다가 갖다 놔야지 산 거는
1,도토리가 많이 났어
1,이거는 뭐니
1,우리 당근도 탈까
1,펴낸이 김성봉 공급처 오르다 코리아 출판등록 아 덜 읽었어 천구백팔십팔년 십이월 사일
1,어이 무슨 도깨비 소리니
1,수리 수리 박사님 덕분인가봐요
1,최고 잘 했어
1,작은 통에 쭈르룩 큰 통에 콸 콸
1,조금씩 뜯어서 붙이는 거야 이렇게 이종현
1,그렇지 또 이거 핫케잌 누구 줄꺼야
1,띵 뒤집어 보세요
1,응 이거는 내꺼구 이건 내 꺼 아니야 아빠 꺼야
1,연필 해 봐
1,어흥 사자야 안녕
1,똑같이 생겼잖아 그렇지
1,어 예주야 이 악어는 뭘 먹고 있어 뭘 마시고 있어
1,이건 밀가루고 요건 우유에요
1,이름 어딨어 어디 있어
1,십오분만 하면 되지 뭐
1,머리에 쓰는 것
1,엄마가 되게 무서웠어 안 무서웠어
1,이름야 기저귀 좀 갈까
1,그래 너희들 말이 맞다 잠깐만
1,가 나 저거 아 가 쓰는 거 이건 언제 샀니
1,어떻게 알아
1,빠나나 주세요
1,응 맞아요 많이 하면 떨어져요
1,종현이 다 먹었어요 맛있게 먹었네
1,안 되죠
1,어 이름 응가 했다 응가 하면 응가 했다고 엄마한테 말도 해 주고 멋져
1,줄이 끊어지면 강물에 빠져 죽겠지 꾀동이는 다리 앞에서 멈칫 멈칫 했어요
1,토끼는 알을 낳지 않는다는 것을 발타자는 벌써 알고 있었거든요
1,어 꿍 어 꿍 했네
1,아 그래도 되지
1,알겠어요 누구 하나 또 있을 거 같은데
1,그럼 예뻐요 하지
1,그래 지하에서 본 렉서스도 있다
1,신데렐라는 무도회장을 서둘러서 막 빠져나왔어요
1,그리고 야생 고양이 산에서 사는 고양이
1,그거 뭐야
1,어 어 친구가 웅덩이를 쑥 들어갔더니
1,할머니 어디 가시는 거야
1,아까 참새
1,하나 둘 셋 넷 다섯 여섯
1,그럼 가서 케익 계산하고 와요 이름가
1,얘는 연
1,개울이 어디 있어
1,응 응 그렇지
1,우윙 신칸센처럼 빨라 신칸센 어떻게 가
1,그네가 타고 싶은 는 울지 않고 이렇게 말해요
1,우와 오오 파란색 바다와 파란색 돌고래
1,이게 뭐게
1,포크레인이 그렇게 움직이지요
1,응 할머니 할아버지 오신데
1,일로 와
1,잠자리 애벌레는 물가에 가지 않는데
1,지원이 배는 어디 있니
1,그렇지 불끄러 가는 차지 사다리도 있고
1,이거 봐 싸우네 이 막 싸우네 이렇게
1,응 강아지는 멍멍
1,이건 못견디겠다 빨리 도망가자 피망맨은 못 당해
1,나는 하늘에서 살아요
1,누가 또 엎드리래 우리 이름이 어
1,귀가 보이네
1,던져 놓으면 돼요 안 돼요
1,이름이 잡자
1,자 오늘 한 지붕 세 가족에 대해서 읽었어요
1,우리 시마지로
1,씨앗을 심어요 깊이 깊이 깊이
1,어 책 집 어
1,아니야 잘했어
1,잘 있어 얘들아
1,가까스로 자동차 경기장을 빠져 나오는데
1,자 서 자
1,이름아 두더지 안아 줄래
1,응 배 통통통통통통통통
1,다람쥐 닮은 거 같아
1,부엌에 가서 장 본 거 냉장고에 넣어 볼까
1,그리고 또 아기는 태어나면 이빨이 있게 없게
1,여기서도 해 볼 거예요
1,잘 했어
1,어 바닥에 떨어졌어
1,지원아 아이구 그만 하자 그만해
1,응 여기 이거는 뭐야
1,애기들 다 처음엔 낯설어 가지고
1,자 똑같이 붙이세요
1,우리는 임금님의 궁전에서 왕자비를 고르는 무도회에 갈테니
1,멍이 코자는데 눈 뜨고 코자니
1,북적북적 우리 동네가 좋아
1,응 할머니 토끼는
1,뛰뛰 빠빵 뛰뛰 빠빵
1,종현이 사진 찍잖아
1,응 예주 자전거 타 본 적 있지요
1,신기하다 닭고기 국도 있어
1,안 무서워
1,세윤이는 코끼리 열기구 타
1,빨간 색 비가 내리면 오싹오싹 왠지 으스스
1,그래 이 낡은 건물을 부시고 이 건물로 새로 지을 건가 봐
1,쿵 쿵
1,유치원에는 장난감도 아주 많아 올망졸망 예쁜 장난감들 말이야
1,재미 있어
1,네 남자 앤데
1,그렇지 앙앙하고 깨물어야 되지 송곳니로
1,토끼 삼총사와 공주님
1,가면 지원이 이쁘다 할텐데
1,여보세요 초롱이니
1,짝짜꿍 짝짜꿍 짝짜꿍 짝짜꿍 짝짜꿍 짝짜
1,높은 가지 위에 새들
1,이거는 뭐에요
1,목마 거울 뾰족구두 뾰족구두들이 놓아져 있었대
1,인영이 곁으로 모여 들었어
1,그거 어디 놀러 간 거야
1,그리고 난 확실하게 알았어요
1,이런 거를 이렇게 목에 걸고 있는 게 너무너무 좋았던 거야
1,다시 한번 말해 봐
1,세윤이랑 엄마랑 아빠랑 어디 갈까
1,아이구 잘 하네 이거 뭐에요 다시 해 봐
1,자 누구게
1,엄마 안 좋아
1,사과 어디 있어요
1,콩알만하던 구멍이 밤톨만큼 커졌지만
1,아이고 잘 하네
1,엄마가 타기엔 너무 작아
1,멋지고 느긋한 소풍을 즐기자꾸나
1,아니지 이리로 와야지요
1,근데 피 속에
1,아이구 잘 하네
1,우리 로켓트는 어떻게 출발하지
1,그러던 어느날 할머니네 돼지가 새끼를 낳았어
1,아니 너는 이거는 엑스야 이거는
1,엄마 새랑 애기 새가 있네
1,콧물 나오네
1,많이 먹었어
1,강둑을 따라 길을 걸어보세요
1,엄마는 비행기
1,풀이 어디 있어요 풀
1,이 옆에 있는 것은 뭐야
1,교회 어디 있어 교회
1,자 우리 무슨 책 먼저 볼까
1,여기 이 배 안에는 뭐가 들어있게
1,자 수저 줘 엄마한테
1,빠빠 이 끊어 해
1,앉으세요 고슴도치
1,엄마랑 또 생일 축하 해
1,대개 하루에 두 번 젖을 짜는데 이 때 소들은 외양간으로 돌아가야 합니다 다음 그렇지
1,글쎄 엄마도 모르겠네
1,엄마 말 잘 들었나 봐요
1,엄마는 아기곰이 잠 들 때까지 재미있는 동화책을 읽어주셨답니다
1,그건 마요네즈잖아
1,뱃속에서 연기가 나니까 앗 뜨거워 그러고
1,알았어 엄마 볼게
1,뭐라고 다시 말해봐
1,코끼리 소린가
1,키에다 후했는데 언제 이거 했어
1,으음 하고 있어
1,거봐 거봐 거봐
1,이름이 졸리구나
1,빅 벌드 해 봐
1,더운 나라 물 속에서 살아
1,오오 요기는 그렇다 그치
1,맞았어 장난감 기차가 칙칙폭폭
1,그러더니 애벌레가 잠을 자는 거에요 커후
1,오 손가락이 다섯개씩 있네
1,네 발로 따닥따닥
1,여기다 놓구 봐 할아버지 하고 보자
1,이거 빵이에요
1,거기서 도깨비 나와 안 나와
1,알았쪄요 알았어요
1,부채 어디 갔어 부채 장수 누가 훔쳐 갔나 봐
1,껌 사주구
1,시원한 신발
1,간호사 제일 큰 주사기 가져와요
1,과자 밑에 마이 대디 읽을 거에요
1,여기는 뭐라고 써 있죠
1,네가 손 내
1,자 봐봐
1,그랬더니 할아버지가 괜찮아 네가 무사해서 정말 다행이다 그랬어
1,비켜 미끄럼도 내가 먼저 탈 거야
1,둥둥둥둥둥둥둥둥둥둥둥 어고 움직인다 움직인다
1,어 이거 보자 우와 이거 뭐야
1,걸리면 어떻게 돼
1,집이 아니라서 이상해
1,그게 뭐야 이름아 응
1,자 차는 빵빵이는
1,슝슝슝슝 내려서 내려서 슝
1,응 어 애 눈 어디있어
1,이거 볼까
1,해리의 배낭에서 뭐가 떨어졌는지 보여요
1,열어 보고 싶어서 어
1,멍멍이보다 크고 못생긴 개가 으르렁 으르렁 쾅쾅쾅쾅
1,꽃잎이 여러갈래인 참외 꽃이 활짝 피었어요
1,다시 이건 뭐야
1,요렇게 눌르면 돼
1,귀저기 갈아줄께 아빠가 달려왔어요
1,종현아 오늘 이천 할머니 이천 할아버지 오신다는데
1,그럼 곰돌이는
1,이거는 침이 아니라 이렇게 카메라 렌즈에 이렇게
1,토끼가 깡총깡총 와서 예주 사탕먹어 이렇게 해 주겠네 응
1,그렇지 또 우유를 우유로 뭘 만들어요 종현이 잘 먹는 거
1,그렇지요 응
1,어 거기 있네
1,응 종현이 왜 왔어
1,악어가 뭐 먹어 뭐 먹어
1,어떻게 할 때도
1,해 봐
1,포소리는 아주 빨리 달려 갔어요
1,어 우리 마을에 되돌아왔네
1,바다 속에 뭐가 있나 무슨 생물이 살고 있나 보는 거지
1,경비 아저씨가 문도 안 열어 준다고
1,어 어색해
1,예주 하나 엄마 하나
1,세윤이 거기서 무슨 동물 봤어요
1,그런데 구멍난 자루에서 못이 흘러나왔어요
1,이건 뭐예요
1,아이코 에취
1,이게 뭐야
1,아이고 엄마가 많이 넘겼네
1,아후 마술이라고 그거 참 재미있겠다
1,오돌도돌한 이 알갱이는 무엇일까
1,곰돌아 제발 이리 내놔
1,배 타면 노래 어떤 것 불러야해
1,어머 애벌레야 너는 나뭇잎을 이렇게 구멍을 냈니
1,조금만 먹었어
1,종현이가 이거 먼지 다 불도저로 들어가게 해봐
1,응 거기는 차가 없네
1,응 그래 세윤이 티라노사우르스랑 알로사우르스가 있잖아
1,응 버스 탈 때 어떻게 타
1,얘 누구야
1,짠 우와 맛있는 맘마 먹네
1,여기는 뭐가 있을까
1,껌정이는 껌정 모자를 씌워 주세요
1,많이 많이 먹었잖아
1,주연이 이모가 사는 일본은 여기 밑에 있지요
1,아니야 손을 이렇게 해서 이렇게 해서 손 손 어디야 손
1,신기하지 세윤아
1,그래서 엄마 아빠가 필요한 거야
1,자 그림과 관련된 일을 하는 사람을 찾아 짠 물음표 스티커가 어디 있어
1,이야 생각보다 잘 하는데
1,파란 불일 때는 갈 수 있지요
1,이름야 이런 것도 할 줄 알았어 응
1,뭐가 보여
1,아이고아이고아이고 멀리도 던졌네
1,달님이가 이렇게 있는 깜깜한 밤에 삼총사가 나가는 거야
1,이거 뭐야
1,뭐야 얘가
1,밖에 뭐가 보여
1,칼 던지기 묘기에서는 절대로 실수를 해서는 안 됩니다
1,그럼 토끼 책이 어디 있어
1,자 뻥
1,네 아휴 착해라 맛있게 먹으세요
1,아빠가 말했어요
1,노랑 택시
1,헤헤헤헤 그림 책이 얼마나 재미있는데
1,이를 제대로 안 닦았더니 음식 찌꺼기가 이에 껴서
1,세윤이 좋아하는 건데 과일 갈고 할 때 쓰는 거
1,바닷가에 가서 뭐 잡았어
1,아버지랑 오빠들은 뒷산에 덫을 놓아
1,천사랑 무슨 약속했지
1,토치 까까가 더 맛있어
1,이거 봐 에이 지저분하게 먹었네 에이 참 이게
1,자 예주가 바다 찾아보세요
1,공사하는 차다
1,우리는 이것을 원자라고 부르지요
1,이거 우유 먹으면 안 되는 거야
1,갖고 와
1,어 그런 거야
1,물이 그냥 촥촥촥촥촥촥촥촥촥촥촥촥촥 나와가지고
1,다 먹었어
1,그렇지 토마토를 맛있게 먹어요
1,짠 커다란 가방에 뾰쪽구두를 신은 애기가
1,거기는 이거고
1,아휴 이 친구 머리 위에 있었어요
1,이것 봐 투명한데 사탕이랑 아이스크림만 둥둥 떠 있잖아
1,그건 세모 모양 여깄다
1,장난감 많으니까 이쪽으로 와 봐
1,자 여기 하나 더 잘라
1,아빠는 더 크지
1,바다 속에서 일어난 일
1,여우도 엄마가 있지
1,그래 우리는 자동차가 빽빽하게 늘어선 찻길에서 아빠를 찾았어요
1,자 곰은 어떻게 했어
1,이것은 무엇일까요
1,얘네가 바다로 가면은 바다에서 같이 싸우면 시간이 걸리지만
