Label,Sentence
0,그 인원 추가 해 갖고 우리가 만 원 더 내야 되고
0,집 안에서 할 수 있는 게 제일 간단한 게 기지개 많이 펴기에요 
0,근데 인제 주제를 좀 넘어가서
0,계속 지속되는 문제라서 그래서 부담은 되지만 또
0,나는 좀 한 번은
0,어느 정도 이제 한 뭐 년되고
0,어 엘리베이터가 없어요
0,아 그러니까 하나 좋은 거 하나 있었는데
0,강아지를 입양한다고 하는데
0,그리고 내 편을 들어 줘 그래서 나는 그게 제일 고마워 
0,여보랑 닮은 보스턴테리어도 요새 많이 키우잖아 
0,정말 여섯 다
0,그 저녁
0,그러니까 요즘은 에이아이라고 해서
0,전혀 이제 조절을 못 하게 되는 거지 
0,이런 과정들이 너무 긴데 약간 배구는
0,이미 젊었을 때 다 찢어진 상태라 가지고 그것이 유지가 안 돼서 그런 거야 
0,어떤 거를 더 선호하고 타 타고 다닐지 
0,살아가고 있는 입장에서는
0,근데 가만 보니까
0,그게 겨울에는 진짜 필요한 거 같아 
0,어 넷플이랑 웨이브온이랑
0,이런 뜻인데 어떠 어떻게 생각해요 
0,존재함 존재 가치가 있다고 항상
0,어 나도
0,내가 노래 제목을 알고 들은 건 아니라서
0,비티에스가 춤을 잘 추는 것은 맞나 보더라고 근데 나는 잘 모르겠어 
0,아 나 또 인제
0,시시 티브이가 필요하지 않을까라고 생각을 해 
0,김 뿌려 먹는 그 맛이
0,쓰고 싶은 논문 주제가 두 개 있었는데 그거를
0,통찰력이 깊어지고
0,각자 방문을 닫고
0,그 결혼해 가지고
0,나도 인문계 나와 가지고
0,그리고 또 폐지를 하게 되면은
0,음 많은 사람들이 하루 종일 이용하는
0,잘 해 와 그래서
0,근데 누구는 만 원을 주고 누구는 만 원을 주고라는 그런 것도 좀 애매하지 않을까 
0,맞아 맞아 
0,얘기를 잘 못 하고 있어 
0,통화를 크게 한다든지 아니면
0,슈퍼마켓 그리고 요즘에는
0,그때 내가 조금 더 열심히 잘 했으면 어땠을까 라는 생각을 좀 들더라고 
0,대기업 같은 데 있잖아 제이와이피나 그런 데서
0,그런 얘기는 안 하고 싶어 
0,비교적 저렴한데
0,집 가까운 데면 좋겠어 
0,원해서 태어난 것도 아니고 이 삶이 평생 너무 힘들었
0,내가 운전 못해 가지고 장롱 면허
0,그 가도 되는 건데도
0,어릴 때 엄청 들었어 동생이랑 너무 좋아해 가지고
0,요즘 호캉스 되게 유
0,전혀 통화를 하지 않아 
0,아까 실직된 노동자들을 충분히 교육해서
0,청소년들이 피씨방에서 묵고 자고
0,그러다 보면은
0,안 하면 안 하는 거고 허 한다고 했을 때
0,하기 때문에 다양함을 뭔가 좀 여 넓게 보고 공 공부를 해 나가는 것이 중요한 것 같아 
0,법을 만들어야 되는
0,그렇지 근데 그
0,필수적인 건 아니다 
0,길이 너무 믹
0,어 인제 결과를 말하자면
0,내가 환자고 인제 주변에 있는
0,대구에 사는데 학교는 원주 쪽이야 
0,어 아무튼 건강하게
0,어 맞아 그리고 되게 그 돌잔치 했을 때 그
0,로스면은 오리고기 말하시는 거예요 
0,처음으로 만나는 자리잖아 
0,그냥 괜히 아 왜 저렇게까지 물어봐 무 뭘 그렇게 궁금해 약간 이런 느낌 
0,아니 원인가 
0,넌 어떻게 생각해 
0,어렸을 때 되게 많이 이용을 했는데
0,아 체육 시설
0,그럼 엄마가 가서 숙모한테 가서 따질 거야 뭐 할 거야 그러면
0,응 국가에서 효율적으로
0,이렇게 막 저 클릭을 하는 경우가 있어
0,그런 애들이 있었다면은 너무 걱정될 거 같아 
0,아이를 대하 대한다는 거에 대해서 걱정을 해서
0,어 취업하기가 정말 어려운데 
0,그 느낌과 좀 대화의 느낌이 다르다고 하나 
0,그렇게 더 진행되지 않을까 
0,보기 좀 힘든 그런
0,가수 좋아해 
0,근데 강아지도 사실 좋아하긴 하는데
0,노란 거 타고
0,같이 모텔 가서 술 마시자 이런 식으로 얘기를 했대 
0,그 편리성을 좀 추구하기 위해
0,부산까지 여행 루트 잘 짜 가지고 가기는 해 가지고
0,나 안 타 봤는데 
0,근데 또
0,뭐 많이 건너 뛰었네 
0,작가 이름을 까먹었는데
0,엉덩이 부분 그 살이 있어 
0,음식으로 유지하려고 하고 햇빛 받고 좀 걷고 이런 식으로 많이 하려고 하거든 
0,친구들하고 월에 
0,성향이 되게 본인의 성격이나 기분에 많이 따라간다거나 하더라고 
0,약간 그 사람들에게는
0,구청에서 지원해 주는 거야 
0,어 경연 대회를 많이 봤지만 처음으로 그렇게 빨려드는 듯한 느낌
0,이 인터넷 연결망으로 좀 앱을 간편하게 만들어서 택시 이렇게 부르고 이렇게 할 수 있게 됐잖아 
0,그럼 그때는 시시 티브이가 예방 목적에 쓰는 거야 아니면
0,동의를 사실 구할 필요는 없없는 게 사실 맞는 것 같고요 
0,그 라면을 난 처음 먹어 본 줄 알았는데 생각해 보니까 나
0,자기소개할 때 엠비티아이를 소개하는 먼저 말하고
0,그 스우파에 나왔던 아이키랑
0,뭐 내년이면
0,많이 안 갔단 말이야 
0,완전히 근데 지금 잘 돼 있다고 얘기했는데 최근에도
0,묘지나 그런 화장 시설이 생긴다고 했었거든 
0,그 사람 구출하고 불길 속에 들어가고
0,그렇지 않은
0,본인의 죽음에 대해서 사실 표현을 할 수 없을 없는 상태에 지금 빠져 있고
0,무슨 하늘인데 무슨 하늘이지 그 사람
0,이제 반대 방향으로 달려 있어요 
0,그렇죠 어차피 그거는 두 탈 일도 없죠 
0,최 아 혹시 최근에
0,어떨까 사실 예전에
0,그래서 그 점에 대해서는 걱정을 안 해도 될 거 같아 
0,난 이제 중국 안 가려고 
0,잘 못 챙겨 줬던 게 요즘에 후회 돼 
0,이렇게 근력을 키워야 되겠더라고요 네 그래서
0,방법도 괜찮다고 생각해 
0,그거에 대한 부담도 크기 때문에
0,그 손해배상 제도 그런 거가 잘 도입이 되는 것도
0,귀리하고 현미 같이 섞어 먹지요 
0,맞아 그리고 막 결혼식은 안 가도
0,그 제가 뭐 신문을
0,우리 집 앞에 산업단지가 있잖아 
0,우리가 그렇게 오래까지 만날 거라는 보장도 없고
0,그렇게 실망스럽진 않을 거 같아 
0,이런 생각이
0,그렇죠 이제
0,그래서 애아빠는 그냥 그 패턴 그대로 하고 출퇴근만
0,돈 잘 벌고 뭐 이런 것도 한다고 하고 하니까 뭐 이렇게 우리 때랑은 많이 틀린 거 같아 
0,그래서 반대 의견도 얘기를 해주셨지만
0,그래서 네가 결혼을 하면
0,물론 이제 과학 기술이 발전해서
0,구파발행이 있고
0,작은 아버지가
0,거기 녹차 맛 요거트도 괜찮아 
0,같이 먹을 수 있다는 게 너무 너무 좋았어 
0,미친 애들 아니야 
0,가끔씩 점심 먹었을 때
0,이제 생식 생필품은 언니가 주로 사잖아 
0,물론 우리 세대긴 하지만
0,아 스트릿 우먼
0,다 고등학
0,어 그
0,무궁화밖에 안 타서 그러는데
0,그러니까 강요받는 것도 힘들 수 있고
0,버스 시간 간격을
0,많구나라고 생각을 좀 많이 했어요 
0,그 정도는 생업까진 이어 가려면 좀 힘든 것 같아 
0,또 그런 건 뭐람 처음 들어봐
0,쉬지 말고 기도하라 범사에 감사하라 
0,네 그래서
0,어 어떻게 보면 남들이
0,그러면 서로 좋아 
0,이제 손해배상을 하든가
0,어 이렇게 마려울 때
0,친구 말만 믿은 거야 이 사람 같은 경우에는
0,집 값이 떨어진다 이렇게
0,걔가 그 후배들한테
0,스타벅스도 그런 식으로 많이 참
0,후반으로 할께 
0,그거하고 또 친구들한테도 한번 되는지 한번
1,자 우리 한번 넘겨보자
1,아빠 돼지는 뒷좌석에서 잠을 자고 엄마 돼지가 운전을 해요
1,한 번 더 옳지
1,집에 가서
1,이름 양말 벗을 수 있어요
1,이거는 무슨 자야
1,그렇게 되어 있어
1,자 이 책 읽고 자 어머 신데렐라 공주는 어려서 부모님을 잃고요
1,이름아 곰돌이 어딨어 곰돌이
1,이거 너무 무거워서 까꿍 못해
1,자 여기 누구 계셔
1,어 여기 리본도 있네
1,예주도 엄마 껴앉고 환화게 웃어야지
1,동물 중에 사람들과 가장 다정한 친구는 개입니다
1,아이 셔
1,피노키오는 할아버지 말 잘 들었을까 안 들었을까
1,사 누가 사는 집 이거 뭐지 여기는 어디야
1,아니 조그마한 섬 말고 여기 여기
1,아프리카 아프리카 어디 있어 아프리카
1,그리고 때리기도 했지요
1,만져 줘 봐
1,어 들어와 일로 우리 집에 온 걸 환영해
1,친구들이 어떻게 했어
1,이건 뭘까 마늘인가
1,종현이 힘이 센 가봐
1,나비가 어떻게 날았어요 나비가 쉬익
1,결국 아빠는 전화를 걸기 위해 아래 층으로 내려갔어요
1,마음에 들어 이게
1,엄마 근데 올 때 뭘 가지고 왔어
1,엄마 아들 어디 갔어요 까꿍 여깄네
1,그럼 아이고
1,그래 안
1,감자 세 개를 먹을려고 하는데 생쥐가 와 가지고
1,놀고 나서 정리를 해야 나중에 또 놀 수 있는 거에요
1,동물 친구들은 고개를 끄덕끄덕 했어요
1,여기 보니깐 막 고래도 쫓아오고 늑대고 쫓아오고
1,이삿짐 할 때 싣는 차야
1,엄마 다녀오겠습니다
1,응 해봐
1,엄마 누워
1,옳지 잘 뽑았습니다
1,우와 우리 빨리 전화 걸어야 되겠다
1,엄마가 조금만 주니까 알았지
1,책 봐
1,괴물이다 도망가자
1,우와 재미있다
1,그래 화물 열차는 짐을 많이 싣고 가지
1,세윤이 우리 집 화분에 물 안 주면 어떻게 돼 화분이
1,예 아빠 주시면 돼요 예
1,구 번 문항이 여기서부터 시작인데 여기서부터 하셔 가지고 만약에 어이구 어이구 어이구 어이구 아니오가 여덟 개 나오면은 여덟 개 연속 나오면 그만 하셔도 돼요
1,근데 왜 침대 밑에 무서운 게 숨어있대
1,그래서 새야 고마워 가르쳐줘서
1,그러니까 이렇게 됐어
1,야 그러는 거 아냐
1,어디가 통통해
1,우와 또
1,응 이건 배
1,이 코끼리는
1,무슨 냄새지
1,보초병님 저희는 바위섬에 가야해요
1,있잖아 내가 왕자님 선물을 줄려고 낚시를 하는데
1,나는 바위 틈새를 빠져나와 샘으로 퐁퐁퐁 달려나왔어요
1,이 문이야 가장 좁은 문 여기에 박쥐가 드나든 흔적이 있어
1,영차영차 양말은 양말통에 넣어요
1,이건 뭐야 세윤이가 좋아하는
1,이거 뭐야
1,잘했어 오우 케이크 같아
1,좋아 앞으로 잘 지내보자
1,시 신나게 불러요
1,뚱 우와 이게 뭐야
1,이거 봐 되게 신기하지
1,우산 그림인가
1,전화소리가 들리니
1,이거는 지하철 가도록 땅 속에 굴 파는 기계야
1,한 컵은 세윤이 주스 마시는 그 컵을 한 컵 두 컵 세 컵
1,흐린 글자를 따라 쓰고 물건의 이름을 큰 소리로 말해 보세요
1,회사는 엄청 재미있는 곳일 거야
1,코코 아줌마 작아지는 비밀을
1,자 그러니깐 어머 여기서부터 여기까지 뛰었다 그렇지
1,딱따구리 요거 뭐니 요거
1,이 친구도 아빠가 좋다
1,잠깐만 지금이 유월달이면은 만 이십오개월 이십육개월 이십육개월이야
1,원숭이가 먹다가 남긴 바나나 조각도 막 집어 던졌네
1,누구야 세윤아
1,이렇게 이렇게 지붕이 있으면은 지붕 위에다가 침을 꽂아 놔
1,고슴도치가 새끼들에게 젖을 안 보이잖아
1,필요한 것을 골라 영표해 보세요
1,그래 그럼 어디 두고 보자
1,이게 문제잖아 이 소리를 한번씩 들어 봐 헷갈리니까
1,그런데 왜 끈에 미터란 말을 붙였을까
1,현수야 유치원에 잘 다녀와
1,그래도 얼지 말라고 이렇게 발로 꽁꽁꽁 보리 밟기를 해 꼭
1,이름이 코 나왔네
1,응 이거 한번 열어 볼까
1,땡땡땡땡 열두 시를 알리는 종소리가 다 끝나자
1,예주 그럼 언니랑 싸우면 될까요 안 될까요
1,한개 두개
1,하나 둘
1,그랬더니 거울이 뭐라고 그랬냐 하면은
1,이마 여긴 뭐라고 그랬어
1,사프란은 봄을 알리는 꽃이죠
1,파랗고 넓은 바다에 파도가 들려주는 노랫소리가 퍼지고 있어요
1,꼬마돼지야 맛있게 잘 먹었어
1,세계 금융의 중심지인 홍콩에는 하늘을 찌를듯한 높은 많은 빌딩을 가지고 있습니다
1,마침내 솔개를 피해 간신히 집 앞까지 왔어요
1,무슨 고기인데
1,화가 났어 옆에 있던 먹는 사람들이 아휴 재네는 왜 그래
1,코끼리 코끼리 좀 봐 봐
1,엄마 학교 갈건데 내일
1,공기가 가득 들어있어서 둥둥 떠
1,아이고 짹짹짹짹짹짹짹짹
1,그게 뭐야
1,나무 위에 있던 다람쥐와 딱따구리의 도움으로
1,착하고 귀여운 신데렐라야 네가 무도회에 갈수 있도록 도와드리지요
1,미끄럼틀도 정말 재미있어요 신나는 그네도 타고요
1,잘 맞춰 봐 어디가 각져 있나 이렇게 된데가 어디야 이렇게 네모진데
1,키위 어디 있게
1,저기 봐 저기 무지개야
1,슝 뿡
1,우리도 얼룩말을 따라 신나게 달려 볼까요
1,뾰족뾰족 가시가 있어
1,이거는 뭐에요
1,알이래 곤충의 알
1,머리 감고
1,보라색 미국은 저쪽에 있으니까 보라색
1,으음 벽
1,작작은 섬아 미미안해
1,둘이야 푹신별에서 놀다 가자
1,저희가 사과와 배 대신에 도토리를 드릴게요
1,힘을 줘 가지고 엄마 손을 이렇게 해서
1,뭐가 좋아 다 좋아
1,이게 봤던 거야 아까
1,어떤 거 이거
1,응 울퉁불퉁하게
1,엄마는 주황색
1,어 이빨이 빠져요
1,그래도 이름는 동생이 이름 물었다고 해서 이름가 물거나 그러면 안 돼
1,내 칫솔이랑 치약도
1,왜 아파
1,어 왜 왜 왜
1,엄마 안아 줄께 종현이
1,바닥이 모래 바닥이 아니라서
1,나와 봐
1,어 엄마도 만들었어
1,사자 있지
1,거북이야 거북이는 거북 거북거려
1,아 들어올 때 또 얘기해
1,따르르릉 따르르릉
1,어느 꽃 위에 앉아 있을까 예주가 붙여 보세요
1,이종현 너무 잘 하잖아
1,이거는 치마
1,나는 시골에 가면 볼 수 있어요
1,슝 꽁꽁 꽁꽁 간다
1,이거는 누구 꺼에요
1,풀은 누가 좋아하지
1,빰빠밤빠밤빰 빰빠밤빰
1,사냥감이 어디에 있을까 어
1,세윤이 이게 무슨 소리인지 모르지
1,이 뒤에 볼까
1,한개 둘 셋
1,빠방도 쏙
1,또 막 움직이네
1,산소하고 이산화탄소를
1,왜 풀을 깎는지 알아
1,세윤이가 너무 귀여워서
1,는 지구 상에 사는 동물 중에 가장 크대
1,애 이름이 뭐야 토끼다 토끼가 무서워가지고 눈을 가리고 있는 건가봐
1,세 칸이랑 네 칸만 있으면 끝나요
1,부끄러운데 그랬어
1,친구들도 다 일본말하잖아
1,아저씨가 몸이 많이 아프시니까 아저씨네 집에 갔다와라
1,종현이 길 찾기가 재미있지
1,자 데꼬 데리고 다녀
1,뼈 옆에 이거 뭐야 이거 뭐라고 그랬어 엄마가
1,그것 봐
1,할아버지 할머니께는 새 봄까지 따뜻하게 지내시라고
1,으흥 거기 있어 종현이 고추가 거기있어
1,그거 보고 공이 킥킥킥킥 웃었어요
1,또 오세요 또 사러 오세요
1,사 번이 이름이 뭐야
1,양을 태우고 버스가 달려요 메에
1,아이고 지원이 좋아하는 거 봐라
1,어머 엄마는 몰랐네
1,어 이름이가 해 볼래
1,똥 바빠
1,기찻길만 해 맨날 기찻길
1,안마 어떻게 하는 거야
1,그런데 한 번은 내 꿈이 이루어 진 적이 있었어요
1,응 장수 하늘소
1,런던 영국이에요 영국의
1,아이 그게
1,찐이 머리에 뭐 있니
1,자 꿀꿀 돼지 누구게
1,아이고 잘 했다 종현이꺼 종현이가 이렇게 다 먹었어
1,아팠어요 빨리 오세요
1,그러면 이천 십 이렇게 읽는 거야
1,이건도 지
1,자 얜 누구야
1,연료 들어있어
1,안 아퍼
1,나왔다 우와
1,이리 와 봐
1,이름이가 해 봐 이걸로
1,아이고 아이고 아이고 아이고 접시 꺼 내고 자 뭐 담아
1,여기서 맘마 먹는 거야
1,밑에 뭐가 있어
1,근데 수연이도 아야 했지
1,이사람은 누구야
1,종현이는 이렇게 많이 먹는데
1,배추 어디 있어
1,난 하루 종일 집에만 있었기 때문에 우리 아기들 밖에 못 봤단다
1,크리스마스 트리 줬네
1,고양이보다 조금 더 사납게 생겼다고 그러더라
1,짜잔 여기다가 맞는 모양을 찾아서 이렇게 쏙 넣을 수가 있어
1,친구들이 벌써 왔나
1,맞았어 소방차
1,관 둬
1,응 갔어
1,두 명 누구야 누구랑 누구야
1,암 이뻤니
1,또 뭐 해 볼까
1,우리 시마지로
1,원숭이를 제일 좋아했어요
1,모두 앉았니 자 출발
1,롯데 가고 싶어
1,엄마 아빠가 새끼가 나오면 서로 먹을 거를 사다준대
1,이거는 맛있는 이건 뭐에요
1,오이 오이 오이 오이 오이 오이 오이 오이
1,어휴 닫혔다
1,비누는 비누는
1,알았어 찾아와봐
1,로 봇
1,어제 안그랬어
1,좋아요 이거랑 똑같은 그림 카드를 여기 올려 놓으세요
1,아이 멋있다 이종현 하이 포즈
1,영 한마리의 못 잡았어요 토끼가 워낙 빨랐으니까요
1,어어 맘마를 뭐라 그런다구
1,근데 거기 상처난 게 지금도 피 나나
1,자동 차
1,근데 여기는 뭐가 있어
1,얜 누구
1,어 막 여기 캠퍼스 너무 넓어
1,지원아 지금 하늘에 뭐 있니
1,봐봐 곰이 몇 마리야
1,그랬더니 돼지가 너무 너무 신났어
1,그렇지 풍선 비행기에요
1,그래도 요게 제일 마음에 들어
1,이거는 돼지
1,오늘은 특별한 날이니까 친구들에게 가르쳐줄게요
1,아풍이 없어 거기 있어
1,잠시 후 문 밖에서 자동차 소리가 들려왔어요 빵빵빵
1,옷이야 옷
1,여기 애벌레 있잖아
1,손이 아니구 이거는 커 다란 귀야
1,날개는 있지만 날 지는 못해
1,무슨 빠방
1,이렇게 큰 배도 있네
1,종현이도 병원 갔었지 어
1,그런데 괜찮아 영차영차
1,그래서 유치원 선생님 감기는 언제쯤 나으실까 하고
1,그게 뭐에요 아이스크림이에요
1,또 있네 말
1,케이크 할 때 성냥 주지 제과점에서
1,거꾸로 된 비행기 노리모노 책에 있나 찾아볼까
1,그걸로 하지마
1,토끼 배는 몇 개 있어 여기
1,장난감이 엄청 많아
1,꼬까를 지원이가 아까 뭐라 그랬더라
1,은행나무 은행나무
1,근데 삼촌이 왼손을 오른손에 끼고 오른손을 왼손에 끼웠어
1,이게 뭐야
1,응 알았어
1,그렇게 없다 그랬지
1,모기가 깨물었어
1,달님이 하늘에 떠 있어 여기 집에 불이 켜져 있는데
1,예주는 응가 어디에서 눠
1,이번에는 곰돌이가 울음을 터뜨렸어요
1,어 다시 붙여 줄게
1,뭐 볼꺼에요
1,요건 뭐야
1,엄마 도와줘 볼게
1,아이고 잘 해
1,응 힘센 토동이 날센 깡총이
1,지원이 뭐라고 말할 꺼야
1,할머니 것도 티켓 사야 되고
1,아 왜 울어
1,기린 은 어 기린인지 어떻게 알았어요
1,치치푸푸 치치푸푸 치치푸푸 치치푸푸
1,아니 불쌍한 아이에게 이게 무슨 짓이냐
1,노래도 태권도도 글도 잘 쓸수 있어 꿀군이는 어깨가 으쓱 거렸어요
1,칠은 일곱 요기 요기 밑에서 밑에서 여기
1,야 사고 나 봐봐 사고 나지
1,응 싸움만 했어
1,소금 장수는 자랑스럽게 말했어
1,아가가 이름이가 던지면 아야 아야 할 텐데
1,아이구 다시
1,햄버거 먹었어
1,여기 금이야 여기 금
1,어우 우리 양말 바구니 해 놨지 예주랑 응
1,응 옳지 응
1,아이구 잘 읽네
1,다른 거 할까
1,응 응
1,가위 바위 보
1,오 이종현
1,어디로 가야 돼
1,응 여기 오후 점심이 지나고 깜깜한 밤이 되기 전 거기를 오후라고 해
1,엄마는 우람이 방을 들여다 보았어요
1,정말 말썽꾸러기 운전자에요
1,아빠 뭐 하시니 지금
1,들소를 볼 수 있습니다 사람들은 힘든 밭 일을 할 때 힘이 쎈 황소를 이용했지요
1,어 팔도 자유자재로 움직
1,그런데 어떻게 하지요
1,이건 뭐야
1,그러면은 요 뒤에
1,아무튼 그랬어
1,아까 그거 볼까 이거 발
1,까꿍 까꿍
1,아이고아이고 무릎 다쳐서 멍 들겠다
1,왜 곰돌이
1,아이고 웬 상자가 있어요
1,그렇지 파란색 동그라미지
1,자 붙여줬어요
1,버스도 있고요 자동차 트럭도 있답니다
1,밖에 나가지도 못하고
1,엄마 신을 신어서 아기가 넘어졌지
1,열기구 나라는 바다 저 멀리까지 펼쳐져 있었어요
1,아차 내가 우산을 쓰고 왔구나
1,울지 않고 얘기하니까 우리 아기 참 예쁘네
1,이제 우유 먹으면서 엄마 좀 봐봐
1,누가 살아
1,미끄럼틀이 아니고 계곡
1,얘 신발 하나 사 줄래
1,짠 이름 일어섰다
1,엄마들 아빠 이렇게 바지 다려주잖아
1,여기 지금 여기 또또는 어디 있어
1,그랬더니 토끼가
1,아이구 착해
1,오른발 들어
1,아마도 하느님은 꽃들을 색칠 하느라
1,엄마는 뚱뚱이구
1,햇님 안녕 잘 잤니
1,어 엄마도 치치 해
1,이게 뭐야
1,그렇지 하모니카 너구리
1,친구들 모여라
1,어 어디에 들어갈까
1,이거 냈네
1,이거 이거 이름이는 없는 거야 엄마가 딴 걸로 사 줬는데 여기에 앉 여기 누워서 하는 거네
1,종현이 얘기해봐
1,야 지원아 우리 까치책 볼까
1,기차 타고 어디 가
1,오오유 그거 뭐야
1,띵동띵동하고 우리 집 어디로 들어 와
1,어디에 주차할지 안내하는 차라고요
1,응 강아지가 어떻게 했어
1,오렌지 껍질을 벗겨 한 입 베어먹어보니 아이 아이 시어
1,이름야 요 막대기도 넣어 보자 응
1,핑크 네모 여기다 놔 줘
1,아이고 아이고
1,맞았어 육인승 승합차
1,애는 고양이
1,맞아 수는 차례 차례 빼놓지 말고 세야 해
1,글쎄 말이에요 왜 그럴까
1,그럼 얘는 실이 짧아 길어
1,어 어 거기 시계에서 불빛이 나와
1,돼지는 뭐 샀는지 따라가봐
1,아빠가 갔나 볼게
1,깡총이는 사다리 사
1,낱말과 짝이 되는 그림을 찾아 선을 이어 보세요
1,종현이 응
1,어 또 뱀도 숨어 있어
1,빠방 책 다 봤네
1,저기에 있을까
1,이거 요기 이쁘다 이렇게 해 놓으니까
1,그리고 자라는 거짓말을 한 거야
1,응 여기도 사랑해 곰은 친구에게 인사 한다거나 주위를 살피기 위해 일어나기도 합니다
1,아 이렇게 하라고
1,아빠 그랬어
1,이름는 서린이 오빠지
1,자 떡볶이 한번 먹어
1,대신 서커스를 보여주세요
1,응 이게 돌이야 돌 떼어 봐
1,자 그럼 여기 틀린 세 개가 뭐야
1,이거 누구예요
1,누구야 여기서 찾아봐 니가 가르쳐 줘봐
1,등을 긁다
1,애들아 왜 그러니
1,할머니랑 가서 물고기 밥 던져주고 왔어
1,어 뚝
1,오야 오야 오야 오야
1,이거 읽을까
1,어 이 토끼가 뭘 들고 가고 있어
1,애는 뭐야
1,예주 병원 놀이 샀으니까 그걸로 우리 치료해줄까
1,아빠 도와주고 있네
1,발바닥에도 털 없어
1,이름 놀면 엄마는 여기서 코 자도 될까
1,할머니는 고름이 터진 순옥이 눈을 깨끗이 닦아 주었어
1,땅 깊숙히 팠어요
1,지윤이는 몇 살인줄 알아 지금
1,우리 야옹이 어디 있지
1,토끼가 어디 있어 여기
1,감사합니다 감사합니다
1,왜 시골에서 할머니 할아버지가 뭐 뭐 여러 가지 뭐 야채나 이런 거
1,오두막 안에 있는 모든 것은 다 조그만 했어요
1,아이 예뻐
1,길 찾아
1,안녕하세요 이름아 입으로도 이야기 해야지
1,갑자기 궁금했어
1,맛 있어
1,조심하세요 아야아야 꽈당
1,딸 아 빨강색
1,세윤이가 꺼네
1,그 후로 열 꼬마 인디언은 날마다 수박밭에 가요
1,응 거기 있어
1,이름이 안녕
1,지하철은 네모난 모양이지요 우와
1,응 그렇게 정리하고 봐
1,아빠가 들어올 때 띵동 띵동 띵동
1,토미는 동물 우리에 우리를 살펴보았어요
1,여기야 여기 잘 봐 그렇지 됐다 또
1,됐다 어디다 붙이는 거야
1,코돌이는 어떻게 했을까
1,티비가 안 켜지네 이상하게
1,붕 붕 꿀벌은 꽃을 좋아해요
1,그래서 현수는 원숭이를 했어요
1,트윙클 트윙클만 한번 불러줘 엄마한테
1,책꽂이에다가 꽂고 있지
1,어 요렇게 들리네
1,아이고 그렇지 아이고 아이고 너무 잘 해 아이고 우리 종현이
1,종현이 동생 예뻐 안 예뻐
1,거기 앉아 봐 봐 여기 앉아 봐
1,팔 종현아 이거는 뭐야
1,장난감 기차가 칙칙폭폭 머나먼 하늘로 여행을 떠나요
1,이거는 뭐야
1,마늘은 아이 매워
1,그러는게 아니야
1,누가 누구랑 놀아
1,그래서 도와줄게요 그러고 으쌰으쌰으쌰 했는데
1,어머 언니가
1,기차 타고 어디 가
1,침실도 있고 그네어 그러네요
1,엄마를 찾아가는 토끼 찾아봐 예주가
1,아이구 아직도 그렇게 발음이 안되냐
1,니가 갖고 와
1,니가 말하는 속이 빈 텅 빈 네모를 찾아 봐
1,사십 분 동안 놀아야 된대
1,이거 이름야 여기 컵도 있나 봐
1,무서워 안 무서워
1,어 언니 잠깐만 내가 조금 있다 이거 거의 다 끝났으니까 연락할게 어
1,이제 변기 가서 누어야지
1,이름야 이거 봐
