Label,Sentence
0,그래서 나는 대 대 대중교통을 이용하느라고 약속 시간에 늦은 경험도 굉장히 많이 있었어 
0,얘는 예능을 잘하구나 이런 생각 했지 
0,저 사람 마스크 쓰면 나도 쓸 게 막 이러는 거야 이러면서 눈치 주는 거야 그래서
0,인제 한 분이
0,약간 이런 사생활이 아니고 공공적인
0,뭐 이런 일도 있고 저런 일도 있었지만
0,요즘에 잘 케어해 줘서
0,아마 이게 직장까지 이어지게 된다면
0,아 근데 원래 디자인 쪽은
0,그러면은 내가 원해서라도 뭐 제사를 지내고 하겠는데
0,진정한 친구 세 명만 있다면
0,누구나 자유롭게 말을 할 수는 있어야 하지만
0,이제 시골에 데려가서 키워 가지고 이제 커서는 이제
0,이렇게 막 저 클릭을 하는 경우가 있어
0,나 부산 한 번 다시 가 보고 싶다 부산 안 간지 되게 오래 됐거든요 
0,저는 사실 저는 가 본 데가 진짜 많거든요 
0,그 뭐지 지원금 그것도 들어왔으니까
0,약간 예민하잖아 그래 가지고 막 작은 거에도 좀
0,사용할 수 있도록 저희가 해 줘야 되겠네요 
0,신발 같은 경우에 얼마 전에 샀는데 
0,그렇게 하는 게 낫겠지 우리 집에서 그럼 좀 오늘 밤에 정리도 하면 좋겠다 아 그리고 지난번에
0,몰라 뒷 뒷 이야기 아 그러니까 내용은 다 대충 알긴 아는데
0,나는 인상 깊게 본 거라고는 딱히 잘 모르겠어 
0,내가 봤을 때
0, 학년 때는 그냥 그랬거든 
0,내 집 앞 내가
0,나는 최근에 그해 여름은 봤는데
0,그러니까 따뜻한 옷을 하나도 안 챙겨 갔어 갖고
0,아니면 이제 교실에
0,그래서 중요하게 생각하는 거고
0,그래서 말인데 너네 혹시 다음 주 화요일 날 농구 보러 가지 않을래 
0,일일이 사람들을 만나면서 많은 대화를 하고 또 제 것을 오픈하고
0,서울 지하철이랑 너무 느낌이 달라서
0,근데 지
0,그냥 바로 앉는 사람 있고 그럴 때가 있는데
0,그다음에 뭐 그
0,고시원 같은 데 가면서 빡세게 해야지 그래도
0,뚜껑 열려 있는 걸 본 적 있어 
0,돈까스도 좋아하고 아까 말했듯이
0,감각이 굉장히 무뎌지고
0,이제 나는
0,정도 사이였으니까
0,어 절대 어
0,이익준 교수님 
0,약간 무신사는 블랙프라이데이 때 꼭 들어가 
0,그 점퍼 슈트라고
0,뭐 이런 사람들도 있었잖아 
0,그 구피가 병에 들어 가지고 온 거 같아요 저희가 잘 키우고 있던 구피마저
0,너무 예능에서 똑같은 것만 나와 가지고 좀 그렇긴 했는데 
0,근데 오히려 그때 애들이 그런 노래는 틀어 주면 별로 안 좋아했어요
0,그래 그거 좋 좋은 생각이네 
0,우정이 나도 중요하다고 생각해 
0,그런 것을 보러 갔어야 되는데
0,피티 다루는 걸 많이 하는 직종이긴 한데
0,사람 특성상 조금이라도 자기가 해 온 부분이나
0,힘들어 하셔 
0,근데 그런 게 솔직히 뭐
0,또 안정성 때문에 공무원이
0,아 맞아 어 요즘에
0,아 바다 보이고
0,근데 그것에 비해서 비행기 사고도
0,아 나
0,어 근데 나는
0,어 주제가 되는 거 같아서 저는 
0,지금 세대가 원자력 발전소를 걸
0,근데 요새 사람들은 그러니까 이
0,아니 나오겠다 
0,근데 다른 애들이 되게 싫어 하더라고 
0,그 역무원이 다 그거
0,먹어 가니까
0,코로나 오고 나서부터
0,어쨌든지 핸드폰 두고 가 가방 같은 거에만 그냥 들고 나가거나
0,근데 확실히 서울 가면 진짜 생활비나
0,관음한다 이런 것들이
0,좀 피하게 되고
0, 년 쯤
0,아 다음에는 뭐 어떻게 뭐 이렇게 아 쪼금 안 좋게
0,미용이 생각이 나는 거야 
0,나 내가 학창시절 가장 좋아했던 해외 락밴드가 뭐냐고 물어보면은
0,사실은 정말 운동이랑
0,국민들이 어 저 언론사는 뭐 공신력이 없네 이렇게 생각할까 봐
0,건강식품에 해당되는 그런 것들을
0,오히려 집 가서 더 뭔가를 하게 되고
0,알려 주고 그러기 위해서
0,우리가 너무 자연 자연해서 제주도를 찾는 거지 
0,그래도 스트레스를
0,버려질 확률도 높고
0,그리고 내가 결혼식을 안 하겠다고 하면
0,약물로 오히려 몸이 고통받아 가지고
0,내가 키가 좀 작잖아 
0,그래서 이런 거를 제한하는 게 어떨까 그런 입장에서의
0,병원도 다니고 약도 먹고 하니까 쪼금씩
0,그렇긴 한데
0,또 이게
0,쪼금 정답에 더 근접하지 않 않나 싶어 
0,국민의 알 권리 국민 눈높이에 맞는 그런 언론 중재 위원회가 돼야 된다고 생각이 들고요 
0,지하철 같이 밀폐된 공간에서 마스크를
0,없을 순 없지 근데 열한 시 막
0,그래서 한 번 가 보고 싶다는 생각을
0,어 근데
0,야생 상태를 경험하지 않은 애들이면은 그럴 확률이 높아지는 거 같아 
0,나는 식이섬유 사다 먹고 하니까 
0,아직 그러니까 좀 나도 신경 많이 못 쓰는 거 같아 
0,우리가 아무리 체중 조절도 하고 뭐
0,그런 게
0,분명히 부조하실 분인데 그만큼 서로 친분이 있는데
0,나 아니 그런 것 없는데 잘생기면 다 좋은데 
0,친구 인척 해 주는 알바 같은 거 많다는 거 아냐 
0,듣다 보니까 응
0,나처럼 지방에서 올라온 언니들이 너무 많아서
0,모르겠어 지금 빼기거든 더하기 그러니까
0,어 내가 투자한 데 기업이
0,그 두 명을 받기 받고 그 사이바로 오더가 온
0,막 얘기해서 엄마 아이 됐어 그런 얘기 하지 마 막
0,아니면 살짝
0,그 배설물 냄새가 엄청 심하다고 하더라고 
0,저희 집에 청소년이 다섯 명이 있는데
0,봤었는데 되게 잘생기고 되게 막 탱탱하고 되게 예쁜 거예요 
0,보통 다 전쟁으로 인해서 그게 터졌던
0,현 현 지폐가 없잖아요 중국은 아예 그냥 핸드폰 하나로
0,나랑 동갑
0,뭐 그래야지
0,그래서 나는 그런 가사에 이제 공감을 얻고
0,방금 말했듯이
0,위대한 쇼맨이라는 영화를 굉장히 잘 봤는데 거기 나오는 음악들이
0,업무 이후 시간에 내가 그 일을 도전하고도 있고
0,너는 지쳐하면서도
0,나는 미니 용량 많은 걸로 나오면 바꾸고 싶다 
0,근데 구할 수 있는 사람이 너무 적어
0,그렇게 막 흥미가 있고 이런 건 아니야 
0,우리 애들 우리 신랑 다 그
0,일단 그냥 전 그냥 도시나
0,스트리밍 사이트 아이디를 줄게 
0,잔 그런 활동 같은 걸 좀 하는 거지 
0,오래돼서 그렇구나 호선 어 어 
0,되게 좋은 교육을 받기 위해서는 되게 멀리 가서
0,거의 케어하는 게 없고
0,여러가지 먹기로 하지 않았어 떡볶이 먹고 마라탕 먹고
0,더 오래 보고
0,왜냐하면 애기한테 들어가는 돈도 너무 많더라고요 
0,죽을 때까지
0,우리 거 제품에
0,그런 게 더 많이 팔리니까 그런 거 같은데
0,처벌해야 된다고 생각해 
0,근데 뭔가 월급을 받으면서 계속 회사에서 살면은
0,어 집에 생와사비 있어 
0,그것도 되게 열심히 보고
0,막 환자들한테 공감이 필요한 간호사 같은
0,아 이렇게 돌 때가 있어요 그래서 이제 간편하게 이제
0,문을 열고
0,사람들이 언론 말 한 마디의 무게를 잘 알고
0,영어 아 영어 해야 되는데
0,줄여 달라는 요구를 하실 때가 있기는 있지만
0,뭔가 이제 자유가 없어진다 그 생각도 들고
0,저녁은 안 먹지 
0,가 아니다 범인 아니고 그냥 자살
0,그다음에 가장 안전하고 그렇게 인식을
0,만약에 안 됐어 그러면은
0,놀려고 가는데 
0,옛날에 근데 팔팔 올림픽 하고 이럴 때 있잖아 
0,아 옛날
0,근데 결혼이라는 거는 집
0,내가 어떤 행동을 하고
0,너무 너무 재밌던데 한번 해 봐 진짜 재밌어 
0,어 용인역 
0,혹시 인터넷 광고 보고
0,그게 내가 요즘에 이제 빈티지한 옷을 좀 
0,라고 말하는 사람들도 있게 있어서 투자하는 게 
0,활용 활용 이용할 수 있다면 나도 그 부분에서는
0,야 그거 보고
0,그거를 어떻게 처리할 수도 없고 그 쓰레긴 계속 쌓이는 거잖아 
0,받았었던 거 같아 
0,응 응 
0,거진 비슷해 
0,잡스한테 물어봐 
0,어 좀 불 맛이 난다는 게 좀 뭐랄까 좀 야외에서 좀
0,내 친구가 다녔다 해서 내가 전화해 봤다 했잖아 
0,찜 같은 거 하고 그렇게
0,아기들은 이렇게 들어서 옮겨야 되는데 뭐 이 과정에서
0,전에 카페에서 왜 결혼을
0,너무 신기했어 내가 이따가 한번 들려 줄게 
0,좀 결혼이라는 이 관문을
0,시장 경제에서는 그 당장 자본을 많이 가지고 있는 계층이 유리할 수 밖에 없기 때문에
0,그래 가지고 그냥 그럴 바에 떨어지면 월에 봐야지 이렇게 해 가지고
0,근데 생각보다 중국 직접 가서 먹으면
0,지금 당장은 도록 지금 당장 그냥 넘어가다 넘어간다 하더라도
0,거기서 먹는다 하더라고 
0,한 달에 한 번이라도 만나니까 괜찮아 
0,더 형량을 적게 살고 나온다 이제 그런 것이 있는데
0,수영도 내가 인터넷 쳐보니까
0,아 전어회 안 먹어 봤어 
0,발 때문에 따로 하는 건 없고 그냥 산책 정도 하고 있어 
0,혼자라도 보내자 
0,일하시잖아요 이제 
0,술만 퍼마시는 사람도 있겠지 
0,반찬만 해갔다는 거지 
0,뭐 선생님이나 아까 말한 것처럼 이제 판사를 할
0,밖에서 친구들이랑 노는 거 보다 더 좋아하는 거 같다 
0,그리고 공부를 하려고
0,유튜브에 보니까 뭐 미어캣 키우는 사람도 있더라고요 
0,결혼을 하면은
0,자식은 진짜 아닐 것 같고
0,지금 있겠지 
0,뭐 많이 나와 봤자 한
0,거기에다가 교실에다가 만약에 시시 티브이를 설치한다든가 그렇게 놔두면
0,환경은 좀 더 좋아지지 않을까
0,뭐야 다르고 지능이 높은 강아지의 경우 세 네 살이지 다 그거 보다 낮잖아 
0,근데 너무 부럽더라고
0,너는 원래 이런 걸 많이 즐겨보는 편이야 
0,그런 모범적인 친구들을
0,업무 강도가 제일 큰 거 같아요 업무강도가 너무 컸고 그리고
0,쇼핑 좋지 어디서 할까 
0,그렇고 며느리한테 요구하는 것들이
0,저기 당뇨약 받으러 가서 의사 보고 그런 얘기를 했지 
0,또 싸워서 오는 거 같아 그러면
0,그래서 거기에서 사진도 찍고
0,거기서 보면은 요즘 애들이 또 그런 걸 많이 하다 보니까
0,어디로 앉힐지 
0,그 법이 완
0,근데 너무 이쁜 거야 겨울에는 따뜻한 물 막 나오고 그런데 
0,그런 식으로 얘기해 주시니까
0,아니 나는 주례는 살짝 이제 좀 의미있는 사람 선택하는 줄 알았어 
0,아 이 비트와 멜로디
0,아니 그게
0,아주 가깝진 않고 그 어디죠 
0,그래서 나는 그게
0,이제 예전에는 이제
0,그 결혼식 할 때 난
0,건강하게 감량 하는 게 중요하니까 
0,요즘은 내가 알기로는 피티를 안 받으면
0,행사 포인트로 사 가지고
0,이사 오고 난 다음에
0,스무 살 됐는데 할아버지면
0,그리고 항상 피아노랑
0,어 그게 좋을 거 같아 나도 뭐
0,아 나는
0,이 노래는 힘들 수도 있겠다 
0,그걸로 군대를 못 갈 정도로 
0,그 여자 친구가 모처럼 엄마가 올라왔으니까
0,뭐 그거는 개인 취향이니까
0,하루 이틀 정도 쉬는 게 목적이지 
0,굉장히 많은 지원을 하고 있고
0,자기 친구들끼리 다른 지역에 가거나
0,정우가 제일 좋지만
0,맞아 나도 공감 되는 게 많은데 나이 들수록
0,분노라고 해야 되나 증오가 좀 많이 담기
0,예전에 나는 가수다에서 나왔을 때 그때 진짜
0,반대 했었던 기억이 나 팸플릿 같은 거 막 붙이고
0,그 시가 열리는 시간 맞춰서 피시방에 내려간 다음에
0,맞아 어 너 여수 막 뭐 그랬다며 
0,시간 오래 걸려도
0,폭식하고 화장실도 안 가고
0,아니면 여기에 우리가 뭐 하는 거 못 들어오게 내가
0,하기는 하는데
0,인제 우리 나이대는
0,빠지 맞나 
0,이런 게 많다 보니까
0,학벌을 별로 중요시 여기지는 않지만
0,이래서 이용하는 고객들도 많이 늘지 않았나 싶어요 
0,지금도 아이돌 경연 프로그램 그런 게 있어 
0,정수기 보다
0,가끔 보면은
0,엄청 못 미더 아니 나는 우리나라가 아닌 것이 못 미더워요 
0,대기업이나 들어가서
0,나는 그게 아무래도 가정에서
0,엄마 드라이도 안 해 그냥 걸어 놨다가 털어서 입을 거야 
0,뭐 어쨌든 중요한 건 아니고
0,없는 거 같은데 사실은
0,어떤 사이트 망에
0,어 얘기하는 단점으로 얘기하는 뭐 대인관계나
0,너의 의견을 좀 들어 보다 보니까
0,노는 거잖아 정해진 장소에서만
0,격주도 아니야 우린 그냥 대면이야 
0,그 둘 중에 너는 어디가 더 합격을 했을 때 기분이 좋았어 
0,어른이시니까 했었는데
0,간짬뽕을 군대에서 처음 먹어봤단 말이야 
0,그걸 달성했다 라는
0,그런 관계를 쌓는 걸 되게 좋아하는 성향인 거 같다고 느껴 느꼈고
0,부동산 투자를 전 전체적으로 할 수 없기 때문에
0,분위기가 다른데
0,생명을 살릴 수 있다는 거
0,어 맞아 나도 작년에 안 받고 
0,나도 이제 탭도 이제
0,그때도 그날도 코로나는 이것 때문에 비대면 뭐 이것 때문에
0,그렇게 불을 많이 떼고
0,그리고 나는
0,무생채에다 나 새콤달콤하게 했지 
0,그 뒤로는 시카고 피자가
0,어 생각할 수 있었을까 
0,계속 아프게 할 순 없잖아
0,뷔페가 엄청 맛있는 거 알지 
0,난 이런 것도 갑질이라고 생각을 하거든 너는 어떻게 생각하니 
0,여기서 두 시간
0,주식과 비슷한 점은 있겠지만
0,사람이 이제 평가를 해 주는 게 제일 정확하고 하니까
0,그래서 오디션 프로에서 되게 부르기 힘든 곡인데
0,그렇다 보니까
0,음 재밌네요 
0,그때 마지막으로 결제가 첫 그때가 마지막인 거지 
0,쟁여두고 보관하려고 산 거는 아닌데
0,지금보다는 좀 더 나아지지 않을까 
0,뭐 리조트 가는 값이나
0,막 카카오스토리에 올라오는 썰
0,좀 생각이 달라지는 거 같더라고
0,차 필요한 하긴 뭐 차 안 필요한 일이
0,약간 난 사람들과 진짜 다른 거 같아 
0,내가 어 멋있게 입고
0,그렇게 하면서 끝까지 이게 성공하느냐 아니면 중도에
0,그거를 끊겠죠 아예 그걸 못 하게
0,그럴 때 먹는 게 최고고
0,그건 잘 모르겠던데 나는
0,너무 한정적으로 좁혀지는 거 같아서
0,맞아 요즘 걸그룹 보면은 걸그룹이 인기 많은 원인 중에 하나는 한국인 만으로 이루어졌다는
0,근데 요즘은 또 유행인 게 차박이지 않냐 
0,그거 안 써 봐서 나 모르겠는데 아마
0,푹 꺼졌다가 다시 또 만 원이 되니까
0,고양이가 많이 맞지 않을까
0,조금 어필을 더 할 수 있지 않을까 해서 하고는 있긴 한데 나도 사실
0,그렇지만 사람을 보지 않고
0,물을 안 넣고
0,그러면은 어
0,그 사람의 개성을
0, 년 아래 도 마찬가지고요
0,그 이 라인 학년
0,노래도 이제
0,너 실습 몇 번 해 봤어 
0,연 그러니까 더 내가 고
0,욕까지 계속 해 가면서 하는 거는
0,아 진짜 
0,어떤 부지들을 선정하는 데 있어서 땅값이 오르네 내리네 그런 상황에서
0,진짜 근데 그게
0,너무 순수했던 거지 
0,맨 처음에 그랬어 그러니까 오줌은 안 쌌는데 거의
0,기억은 잘 안 나는데 
0,그냥 한 칸씩 앉아서 먹는
0,더 쉽게 버리기도 하지만
0,저도 막
0,근데 제일 하기 쉬운 게 간헐적 다이어트일 수도 있는 게 왜 아침을 꼭 먹으라고 하는데 근데 나 같은 경우는 오히려 아침을 뭘 먹으면
0,성 같은 성격을 띠고 있는 직종을 가진 사람들이다 보니까
0,올해까지는 내 걸로 버틴 다음에
0,그런 거 아니까 그래 
0,내가 마지막 운전한 게 월달인가 월달에
0,그런 곳에서만 에이아이를 도입하는 거는 괜찮지 않을까 
0,아픈데 형 근데 많이 늘어났으니까 뭐 병원도 가 봐야 되는 거 아니에요 
0,애들이 많이 모일 기회가 없어서
0, 랑 같이 스시 뷔페를 가면 우리는 한번 처음 갔을 때
0,그러니까 이제 개인마다 가치 기준이 다르겠지만
0,거기서도 막히는 게 너무 많은 거야 
0,꼭 가야만 되는 그런 상황이 이제는
0,가볍게 하는 것도 좋은 휴양이 될 거라 생각하고 있어 
0,나는 예능을 즐겨보진 않는데
0,더 그래픽화 하잖아 그러니까는
0,엄마들이 더 아이들을 감싸고 도는 거 같아 
0,응 지나갔지만 뭐 그건
0,그냥 기독교식으로 했으니까 그래도
0,고향을 가는데 예전에 명절 때 고향을 가는데
0,예를 들어도 헌법재판소의 뭐 판단을 좀 받는다든지
0,이런 특히 노년층 취약한 노년층에 대한 그런 걸 생각했을 때
0,이런 별장 같은 데를 잡을 거야 아니면 일반 호텔 같은 곳으로 잡을 거야 
0,친하게 되면 또 커피도 마실 수 있고 그런 건데
0,여행 갔다 왔었는데 교수님이 그렇게 설명을 해 주셔서
0, 월이면 추울 수도 있지 거기 뭐 안개 끼고 그러잖아 
0,뭐 먹을 때도 그렇고 약간
0,결과가 안 좋으면 그게 트집거리가 되는 거야 
0,서울역 가면 진짜 많다는데 
0, 원을 안 받는다는 거지
0,이제 면접이 비중이
0,안 볼 수가 없는
0,사진 같은 거 남는 것은 없나 
0,내 친구 남편이
0,아이 솔직히 오랜만에 데이트하는 거라서 좀 예쁜 거 사고 싶거든 
0,뭐 크레파스 열두 색깔 있으면
0,건강 영양제 얘기가 나오기 시작하더니
0,아까 뮤지컬 말했는데
0, 아빠는 이렇게 보면은
0,아 혹시 지옥철이라고 들어봤니 
0,묻힐 수가 있는 그런 환경 속에서 
0,뭐 다른 날은 모르겠지만
0,자기도 지금 운동을 할려고 하잖아 
0,근데 그때 내가 정말 졸린 수업이 하나 있었거든
0,친척들이랑 별로
0,사람의 가치관은 쉽게 안 바뀌더라고 
0,제가 제일 많은 축의금이나 뭐
0,그래서 너 고민 있을 거고
0,경력이 단절되는 사람들이 생각보다 많구나 내 친구들도
0,요양 병원은 아닌 거 같아 
0,어 파크 골프를 같이 치는 것은 당연하단 수순일 것 같고 현재
0,아 맞아 
0,내가 일도 할 수 있는 부분이니까
0,그 수컷이랑 교배도 해보고 싶었는데 
0,어 자주 타는 버스 번호 같은 거 있어 
0,근데 그게 접히는 게 안 접히는 폰보다 확실히 더 나은 점이 있어 
0,아니 아이폰은 너무 불편해
0,뭐 자기만의 고충이 있겠지 뭐
0,미국이나 유럽
0,에스엔에스를 통해서 찾아 본 적은 없고 주로
0,그렇게 나는 사는 것도 나는 괜찮다고 보는데 안전하게 탄다고 하면은
0,무안 하기도 하고 가게 주인한테도 미안하고 
0,그렇기도 하고 재료들이 신선하고
0,그 아마
0,그리고 오늘도 이제 가져 왔는데 이제 하나씩은 계속 들고 다니는 거 같아 
0,자격증 같은 거는 고려해보지 않은 거 같아 
0,바로 비켜주고 하니까
0,거라고 생각을 하긴 하거든 
0,초코파이 할 때 그 정
0,근데 요즘 또
0,어제부터 봤어 도 계속 로 로운 타령하는 거야 나한테 연모 봤냐고 자기 연모 보고 있는데 이제 다 봤고 다음 회차 너무 보고 싶은데 안 나와서 아쉽다고 로운 타령을 하길래
0,문제가 더 심각한 것 같아 
0,그래서 그
0,제가 애들에 대한 친구들에 대한 얘기를 듣잖아요 
0, 생각은 어때 
0,완전히 없어지는 거 나는
0,그러고 되게
0,음 제가 말씀드리는 부분은 뭐냐면
0,에이아이가 우리의 일자리를 많이 뺏어 갈 거라고 생각해 
0,생각을 한 번 해 보는 걸로
0,서울로 올라가는 부분이 낫지 않나 
0,그런 거 생각하면 우리나라가 완전 지금 급하게 탈원전 할 필요가 있을까
0,그런 걸로 충분히 뭔가 포착을 할 수 있는 거고 
0,한때는 그냥
0,진짜 여기서부터 저기까지 완전 큰 갈치를
0,회사에서는 면접 같은 거 볼 때
0,코엑스도 둘러보고 괜찮았는데
0,어 농구 다들 엔비에이 챙겨 보십니까 
0,초등학교 중학교 고등학교 심지어 내내
0,한 네 명 정도 낳고 싶은데
0,영어와 한글의 혼용 라임
0,그러니까 잠깐만 말이 그러니까 정리를 하자면 심석희가 등이고
0,가져가서 우리는
0,기성 가수들도 사실 뭐
0,그러니까 보면
0,여기에서 전단지를 돌리지 말아라 
0,아직도 안 와 가지고 지금
0,그런 형식의 결혼을 하는 사람도 많아졌고
0,어 그러면 몇 시쯤 먹는 거야 그건 
0,그때 우리가 그걸 먹으려고 오빠가 그때 주사 맞고 
0,요즘 이제 원자력 발전소 많이 나오잖아 
0,그냥 버스로 다니는 걸 좋아하거든 
0,그런 건 아니니까 
0,아 근데
0,그래서 기차 여행 되게 좋았던 것 같아
0,그 항상 알잖아요 처음 탈 때 그 앉아서 가는 게 되게 중요한 거
0,더 빠르게 빠르게 성장해 가는 거 같아 
0,고민이 계속 되는데
0,그게 아주 작은 한 사람에 대한 상처일 수도 있지만
0,도움 같은 걸 얘기해 준 적은 없었어 경험 같은 거 
0,다 자기 차를
0,왜냐하면 근데 기술을 수출한다고 했는데 사실상 수출하는 국가 같은 경우도
0,그 얘기들 듣고
0,발을 올릴 수도 있고
0,그냥 동네에서
0,충분히 짐작이 가능할 거 같아 
0,좀 빨리빨리 연구가 됐으면 좋겠어 
0,근데 그것을 타고 어딜 이동하기에는 인제
0,칠리소슨데 좀 더 약간
0,이제 바람이 아주 크지 
0,투자했을 때
0,트램이 지금 뭐
0,그렇지 학원도
0,무슨 엄마 생일이나 아빠 생일 되면
0,지금 빼도 한 만 원은
0,나도 약간
0,학원을 절대 안 보냈었었잖아 
0,너무너무 신기했다 
0,스크린 타임을 아이폰이기 때문에 아이를 보호하기 위한 스크린 타임 기능이 있어요 
0,봉준호 감독이 영화 뭐 뭐 봤어 
0,때문에 나가서 사람도 못 만나고 문화 생활도 못 하고
0,아무리 많이 있어도 안먹고
0,회복이 아닌
0,또 쉽 쉬울 수 있지만 그게
0,그 재무 회계 보다는 재밌지 않을까 
0,그때 내가 생각이 든 게 뭐냐면
0,매 끼니를 먹자
0,생명 유지 장치를 하고 있으면은
0,근데 돌이켜 생각해 보면
0,환자가 많을수록 우리의 경험도
0,근데 그게 어떻게 이렇게 외국에서도 먹혀 같고
0,모르겠어 나는 택시 잘 안 타보고 그래서
0,그러니까 나도 가계부를 나도 이렇게 쓰거든 
0,스마트폰이 없으 없는 세대를 지금은 시대를
0,내 찾아봐야 될 거 같아 
0,진심 그냥 물 속에 있는 녹초 돼서 아 이러고 온 느낌
0,어렸을 때부터
0,우리 세대 때는 스마트폰이 일단 없었어
0,뭐 예전에는
0,되게 사람 기분 나쁘지 않게 말도 예쁘게 잘하면서
0,일단은 당장 계속 뭐
0,어떻게 될 것인가 뭐 힘 없는 사람들의 안전망이 확실한가 
0,분명히 피해가 생긴다는 거지 
0,그래서 그냥 어차피 수능 상관 없으니까
0,같이 가던 동생은
0,이번에 원필이가
0,베트남 음식인가 태국 음식인가 톰얌쿵
0,처음으로 내가 이제 판매를 했던 제품은 뭐냐하면은
0,연인 사이에 전화를 하고 있는데 이제 전화 통화로
0,종목을 한두 종목을 세 종목 해 가지고
0,생각을 많이 했어 
0,음 맞아 남녀노소 뿐만 아니라 뭐
0,밤에 고민을 하면
0,시시 티브이를 설치해야 된다고 생각해 
0,그 안에 땀이 배출이 안 돼 가지고
0,또 쉽게 어울리기 쉽지는 않은데 
0,이것도 서로의 취미나 공통점들이 맞으니깐 지금까지 친구였을 수 있었던 거지 
0,빡빡하게는 못 들여 보내지 까는 딱 제한이 있어 몇 명 
0,그럼 결국에는 시시 티브이로 인해 가지고 더
0,이 제도는
0,되게 모델 브랜드여 가지고
0,다시 생각해 보면 나쁘지 않은 거 같아 
0,그러다 보니깐 성인병에 대한 걱정이 많이 되는데
0,만약에 이것이 계속 존재를 한다면
0,내가 사람들이 되게 많을 때 그러니까 한 저녁 타임 쯤 그때 가 보니까 원래는 분 정도 걸리는 거리인데
0,그걸 하는 사람들이
0,그나마 아빠가 먹는 게 미국 할머니가 보내 주신 엠에스엠
0,규정이 있거나 뭐 이렇게 해야 되지 않을까 
0,얘기를 다
0,있는 이유가
0,돈 돈을 뺀다고 그러잖아 
0,어 나도 갈 때마다 그런 생각이 들긴 해 간간이
0,친구 할머니가 돌아가셔서
0,걔네 집에서 자기도 하고 그랬었거든 
0,곧 우리나라에서도 시행이 될
0,어쨌든 그 그룹을 이루면서 노래를 내면서 하는데
0,그래서 에이아이가 발전을 하면
0, 씨는 아예 대놓고 위드 코르나로
0,유독 잘한다고 나는 느끼지를 못 해 가지고
0,진짜 얇고 얄팍하고
0,차이가 나니까
