Label,Sentence
1,불룩한 뱃속에 아기 금붕어를 위한 영양분이 들어 있어요
1,먼저 해야 할 일이 있거든
1,엄마 있다가 과자 한 개 더 먹어도 돼요
1,세윤이 왼 발 어디있지
1,너 그거 뭐니
1,피터팬은 해적선을 타고 웬디와 동생들을 집으로 데려다 주기로 했어요
1,오오 뭐해 이 아기
1,검정 여기 들어 너 집에 가 이럴까 이렇게 들어가라고 할까
1,이번엔 또 뭐 읽지
1,옳 지
1,두개 다 배야
1,꽃이 시들면 열매가 부풀어 오르고
1,이게 뭐게
1,여기 요리해서 먹는 바나나도 있다고 그랬지 책에
1,엄마는 곰돌이 책 이거 좋아
1,뒤에 잘 보고 오라이 오라이
1,어유 다 컸네
1,종현아 얌냠냠 엄마 다 먹고서는 뭐라고 그러는 거야
1,비가 오면 빨리 집에 가야지
1,어디 있는데
1,이건 뭐야 여기가 뭔지 알아 종현아
1,기차 여기 있잖아
1,그러면 저기 카트 있는 데 찾으러 가 볼까
1,여기 입을 아 벌리면서 오네
1,아침 먹었어
1,파라오가 죽으면 미라로 만든답니다
1,이건 뭘까
1,어제는 숯장수가 당했대요
1,나는 릴리야 오늘은 처음으로 어린이집에 가는 날이야
1,응 이제 이거 하려고
1,시간이 잘 못 나왔습니다
1,신발 구두
1,터널에서 뭐가 나오나 이거 열어 봐
1,어느 날 아침이었어요 트릭씨는 아빠와 함께 거리를 걸었어요
1,예주 너야 너
1,이거 봐 개부랄풀이래 이름 되게 웃기다
1,이렇게 눈이 하얗게 오면 보리가 잘 자라 이불삼아 덥고 있으니 덜 춥지
1,거울 보러 갈까요
1,응 언니는 뭐 해요
1,또 해 볼 거야
1,응 응 해 봐
1,이게 증조할머니야 여기 여기 여기 여기 여기
1,응 여기 봐 여기 누구야
1,이 지역의 주요 산업은 대구와 새우잡이래
1,응 책 읽고 놀까
1,아니야 사자가 여기 있겠어
1,응 사자 그림 떼어 봐
1,딴딴딴 딴딴딴
1,또 막 자려고 하는데 딱딱딱딱 딱따구리가 지붕을 쪼아요
1,응 자
1,응 그렇지 세 살
1,모래 놀이 하러 갔다가
1,응 여기 이거는 뭐야
1,그 봐 잘되지
1,어 또 그랬어
1,응 여섯이지
1,소리가 안 나네
1,칙칙폭폭 이거 이름이가 할 거예요
1,캥거루도 엄마가 있을까
1,한번만 먹었어
1,그러면은 할아버지한테 해 달라고 그래
1,씽씽쌩쌩 불화살이 밤 하늘을 가르고
1,좀 이따 할아버지한테 갈 거야
1,바늘에 손 찔리면 어떻게 돼
1,여기지 이 앞에 바다 이름이 뭐야
1,어우 거기 있어 자 이거는 뭐야
1,너는 아빠 뱃속에서 생겼어
1,응 아 옆에 막 의자랑 컴퓨터 같은 게 있으니까 궁금해 가지구
1,아 제 주민등록번호요
1,아빠는 시간이 너무 늦었다며 트릭씨를 달랬어요
1,우와 호비가 엄마랑 기차역에 왔어요
1,우리 가위 한 번 예쁘게 붙여줄까요
1,그러니까 종현이는 어떻게 해야 돼
1,이번이 크겠지
1,이모부 한국말 잘 해
1,그러면 진이는 어디가 이쁘게 생겼어
1,짠 누가 나타났어
1,고기가 아야 그런다 이렇게 여기 잡았잖아 이렇게 그렇지
1,아휴 응아가 다 갔는데 얘가 쉬 싸서 어떻게 했어
1,여기는 어디지
1,독수리가 날고 있다
1,그 논문을 쓰고 가지시는 게
1,자 강아지의 콧등은 늘 촉촉하게 젖어 있대요
1,글씨 읽어 봐 바위 이게 바위야
1,아 진짜요 아이고
1,아기곰은 무슨 일이든 울기부터 해요
1,그렇지 뻐끔뻐끔뻐끔뻐끔 물고기가 있네요
1,고양이는 읽어야지 책을
1,그렇게 해서 아이고 잘하네
1,아니지 이거는 연두색
1,얘는 뭐야
1,근데 이건 녹음기예요
1,뭘 가지고 놀아 볼까 또 다른 게 뭐가 있을까
1,엄마 어디로 가
1,여기 있지
1,블록은 블록끼리 분류하고 오세요
1,사마귀는 둥근 잎사귀에 숨어 있습니다
1,한 쪽만
1,예주는 뭐 닮은 거 같아 얘가
1,어 기분 좋고 항상 고맙습니다 이렇게 말을 잘 해야 돼
1,한 손으로 더 도와줘 이름 왼손으로 같이 도와줘
1,미끌미끌 이거는
1,피터팬의 울음 소리에 놀라 막 울었어 피터팬이
1,컵 입에다가 슈웅
1,아니잖아 아니네 아니야 아니야
1,아닌데 이렇게 치는 건데
1,예쁘다 어우 부드러워
1,잘 봐
1,항상 이렇게 안전벨트를 해야 한답니다
1,아이고 고마워 시마지로야 고마워요 그랬어요
1,밑에 잡아야 될까 봐
1,자 어머 얘는 똑같고
1,영차영차 양말은 양말 통에 넣었어요
1,왜 그러니
1,어디 봐 없네 스티커가
1,막 울었어
1,나비 몇마리 있어
1,응 돼지잖아 돼지도 한 마리
1,어우 달팽이들이 계속 말해
1,그래서 곰돌이가 어떻게 됐어
1,말 세개 있어
1,아유 아파요
1,어느 날 할머니는 얼음 벌판에 나갔다가 하얀 아기 곰을 만났습니다
1,띠띠 뿡뿡
1,어떻게 알았어
1,응 올리는 거야
1,아 그런 거에요
1,이름이 안 뇽 안녕 안뇽 안녕 어흥 안뇽 안녕
1,난 원숭이보다 힘이 센 사자 하고 싶은데
1,호랑이 생일인데 누가 이렇게 멋진 꽃다발을 들고 왔어요
1,어 아무리 봐도 없네
1,식탁 맞아
1,할머니 뭐 하고 계시니
1,그래 책 읽자
1,여기서 이렇게 물이 나오면 이름이 앗 차거 차거 요거 하면 되는데 그치 그렇지
1,가야 돼 말아야 돼
1,누구야 누구 생일할 거야
1,그래 세차 하는 데 거기 옆에 가서 넣지
1,응 여기
1,풍뎅이 아가씨 차에 불이 나서 소방관들이 불을 끄러 왔어요
1,이 자동차는 경주용차랍니다
1,응 금붕어
1,으흠 자
1,그래요 할머니가 뭐라고 그랬지
1,고속도로는 빨리 간데요
1,자 이 친구 뭐하는 거에요
1,건초가 돼지를 실은 수레
1,이름이 말 탈 거야 엄마 탈까 이름이 탈까
1,이거 읽어야지
1,어 그럼 저 숲 속에 있는 저 빨간게 내 사과인가
1,응 엄마가 까 줄게
1,잘 놀았어요
1,이렇게 탔어
1,하지만 다행이에요 선물은 앉고 있었으니까요
1,자 식사시간입니다
1,토끼 그렸대매
1,이거는 한복
1,모자를 찾아주어서 고맙습니다 그랬어
1,동그란 게 하나 더 있었는데 여기 있다
1,흙탕물 아니었어
1,아니 저 별은 세지 않았니
1,지금 찐이 뭐해
1,꽂히셔 가지구요
1,와 지원이가 지금 뭐하니
1,너 몇 시에 잤어
1,재미있게 놀아요
1,가지고 와 종현아
1,엄마가 이렇게 해 줄 테니까 이름이가 만지고 싶은 거 만져도 된대
1,삼바는 너무 너무 기뻐서 친구들과 춤을 추었어요
1,자 저녁 때 집에 돌아와 엄마가 말씀하신 것을 다 가지고 왔어요
1,그래 세윤이 좋아하는 거 많이 나왔다
1,응 이름이 잘 자고 왔는데 어 인제는 의자에서 일어날라 그러나 보다
1,많이 많이 먹었잖아
1,어머 여기 또 뭐 있나 한번 찾아보자
1,삐약이 응 자
1,귤두 사다 담구
1,아이구 너 참 장하도다
1,하나씩 줘야지 사자는 못 먹었다잖아 그렇지
1,아 그거는 그거는 음 뭐랄까
1,구멍에 쇄기를 넣고 망치를 밖습니다
1,응 여우 그림이 어디 있을까요
1,아 이렇게 넣어야
1,이거 누구야
1,다람쥐야 정말 큰일 날 뻔 했어
1,잡아 먹을까 말까 그렇게 생각하고 있네
1,지금 해서
1,이렇게 장난감이 많은데
1,배 타고 갔어
1,잘했으 잘했어
1,종현이 엄마 기다렸어
1,그러자 달이 생각했어
1,어구 낯설어
1,아 슝
1,거꿀로 매달린 집에서 살어
1,무슨 피
1,생선 고기인데
1,사다리가 쑥 들어가는 구덩이가 더 깊겠지
1,손 이렇게 하면 강아지가 손 주지
1,구름과 함께 춤을 추는 저런 기발한 물건을 누가 만들었을까
1,우산이 찢어졌어 안 찢어졌어
1,다람쥐 또
1,종현이 우리 유치원 갔었지
1,거기 있어
1,장난감 하나도 안 치우고 있지
1,그렇지 또 우유를 우유로 뭘 만들어요 종현이 잘 먹는 거
1,그렇지 다 아니야 모르는 사람이야
1,아키아 이모 미국 간대
1,으차 으차 으차
1,약도 줘 내가 먹일게 여기서
1,산타 할아버지 예주가 좋아하는 토끼도 있네 토끼
1,어 전화가 잘 안 되네
1,사십 분이 생각보다 길 것 같다 그지 그렇지
1,엄마 잠깐만 꺼주세요
1,세윤아 왜 집이 날까
1,이건 뭐에요
1,종현이는 너무 잘 알어
1,너 우유 먹었으니 쉬 하자
1,어 예주야
1,하하 요거 뭐니
1,콩세고 있었어
1,여기는 공공도서관 도서관에 가면 책을 빌려 주는 사서가 있어요
1,어 누구야
1,뭣들하고 있느냐 어서 독을 치지 않고
1,응 팬더 곰
1,유치원에 이걸 누가 갖고 다니는데
1,짜안 그러고는 마리아하고 요셉하고 자
1,아 다람쥐가 도토리 먹고 있는 거다
1,으응 뽀뽀
1,이거 여기 그어봐 잘하나 못하나
1,어휴 잘하네 의자에 잘 앉았네
1,영양소를 이렇게 다 몸에서 흡수하는 거야
1,왜 안 된다고 그랬지
1,마벨라는 앞서가다 생각이 났지
1,쫌 어렵게 생겼다 그렇지
1,팔랑 팔랑
1,나쁜 병을 일으키는 먼지가 많아요
1,얘 싫어요
1,응 아빠 할머니 엄마 찐 해서 후 했어
1,얘는 뭐야 예주야
1,애는 언니
1,안 먹어 이거
1,자 애는 포도
1,계란 넣고
1,버스도 세차 할 거야
1,이거 어디 있어 종현아
1,거긴 거기가 아닌 것 같은데
1,또 뭐 해 볼 거야
1,아니야 쿠키는 많이 만들어요
1,그럼 빠붕이들은 다 서 있지
1,아직 미끄럼은 재미가 없구나 네가 응
1,그냥 밤에 할아버지는 심심했고
1,이만큼 컸어
1,자전거 어떻게 가
1,넘어질 것 같애
1,안 돼 모두 차례차례 타야 돼
1,그래서 깡총이가 뿌리를 잡아 당기고 있는 걸 보지 못했어요
1,찌찌가 되는 거지
1,이게 뭘까
1,그렇지 물
1,지원이 팬티 입어야지
1,이거 봐 이거 봐 응
1,개처럼 춤을 추고 흔들흔들
1,자 옷은 어디 둘까
1,아니야 이렇게 해서 책 읽는게 더 재미있지
1,비가 그치자 하늘에 흰 구름이 하나 둘 떠올랐어요
1,어이 지원이 이거 심퉁이같이 생겼네
1,치카치카 푸카푸카 이를 깨끗히 닦고 쓱싹 쓱싹 세수도 잘 해요
1,응 그렇지
1,너 왜 심술이 났어
1,그러면은 하얀색
1,자 바나나 붙이래요
1,그래서 배가 네 개 남았어요 맞어
1,그건 옷에 입는 거를 갖다 이걸로 해 이걸로 이걸로
1,기린이가 긴 목에다가 물을 매고 왔는데도 어림없었어요
1,아버님 차 아버 아버지 차 따로
1,여기 구멍에 맞아야 돼
1,이름 벗자
1,비단 가게 아저씨였어요 그 튀김 만두 다섯 개만 싸줘요
1,참새는 어떻게
1,조개가 자꾸 자꾸 물었더니 배는 대답을 안 해요
1,가라고 그랬어 가 저리가 저리가 저리가 그랬어
1,아이 잘하네
1,엄마는 엄마야
1,그래 미미는 처음에는 쭈뼛쭈뼛했지만
1,아 이제 팬티를 입을 수 있게 됐어
1,그 다음에 이거는 무슨 기차야
1,심술쟁이 어머 이거 누구야
1,이 차를 응
1,다른 거야
1,옷들은 커다란 나무 상자 속에 넣어 두었어요
1,아이고 잘 하네 개미에요 우리 아들이가 잘한다
1,이거는 뭐야
1,짧은 바늘이 시간을 가리킨다고 했잖아
1,이거 봐 아빠 보이지
1,거울아 거울아 이 세상에서 제일 예쁜 여자는 누구지
1,넘겨볼께 종현이가 좋아하는 새가 나와요
1,엄마 여기로 집어 넣었다
1,부라키오사우르스지요 뒷다리에 비해 앞다리가 길어요
1,팔이 몇 개야
1,비켜 봐 이거 넘겨 이제 차에서 내려 응
1,그건 긴 바늘이고 작은 바늘
1,용왕은 물 밖에 있을 땐 작은 도마뱀으로 변신한단다
1,으응 얘는
1,꼼지락꼼지락 곤충
1,누가 이거 길을 막았어
1,차가 어떻게 됐어 어떻게 됐어
1,얘는 뭐야
1,응 인형 옷을 만들지
1,얘 뭐야
1,새롬이가 거짓말 할 리가 없는데
1,얼레빗에서 다래끼 나나
1,어 이거 이렇게 돌아가 오
1,아하 돼지였군요
1,재미있는 인형극을 보고 또 봐도 아무도 나가라고 하지 않네
1,셋째 왕자는 개구장이였어요
1,저녁 때 집에 돌아온 일곱 난장이들은
1,아그 아그
1,어디 있나 버
1,이거 아이 신기해
1,몇 달이 흘러 애드워드는 감옥에서 풀려났어
1,또 엄마 찌찌 해 봐
1,하나 둘 하나 둘 하나 둘
1,야옹이 어디 있어 야옹이 야옹이 여기있네 야옹이 야옹이 어디 있나요
1,여기 있네 농구공
1,으응 그래 꽁
1,여기 그냥 놔 두시면 돼요
1,처음부터 응
1,안녕히 계세요 해
1,낚시를 하고 있네요
1,손이 더러우면 감기가 옮고
1,별은 너무너무 좋아했어
1,여기다 놓구 봐 할아버지 하고 보자
1,음 이것도 또 해 보자 주황색
1,그렇지 저기 자전거지요 종현아
1,응 순서대로 읽는 거야 주세요 엄마
1,아니야 나 할 수 있어
1,아빠가 안 보이면 어떻게 책을 읽어줘
1,아무도 없었어
1,우우 부는거지
1,해님이 지고 나면 뭐가 뜨지요
1,사슴 찾았지
1,뭐 읽어줄까요 예주가 책 찾아 오세요
1,구가 두 개 있으면
1,이게 마음에 들어
1,이거는 뭐야 토마토
1,야 부엉이 무섭게 생겼다
1,세윤이도 이렇게 할아버지 할머니한테 절 하면서
1,나는야 주스 될 거야
1,종현이 여기 뭐야 이거 왜 그래
1,엄마 보여 안 보여 응 엄마 보여 안 보여
1,요걸 요기에
1,슝 아이구 잘하네
1,여기 있는 얘들 중에 스크루지는 누구게
1,지금은 그저 어른 공룡들이 하는 걸 지켜봤대
1,영아 좀 도와줘
1,그래서 벌은 우와 곰이다 곰 하면서 곰을 공격하려고 해
1,그렇게 돼 가지고
1,싹둑싹둑 머리 잘랐네
1,아이고 똑똑해 이거는 여기야
1,누가 살아
1,저거 뭐 하는거니
1,우와 빨간색과 노란색을 섞으면
1,그것 많이 놓자
1,일로 이리로 와 일로 와
1,찐이 제일 이뻐
1,예주는 안 했어
1,종현이 여기 봐봐 이거 한번 물어 보자
1,힘을 더 줘야 돼 그렇지
1,예주가 강아지 신발 하나 해 줘야 되겠네
1,자 누가누가 응아하나 봅시다
1,종현아 뱀은 어떻게 다닌다고 그랬어 엄마가
1,종현이도 차렷 경례 해 봐
1,종현이 생일이야 크리스마스가
1,또 누구 제일 이뻐
1,할아버지가 어이고 그래 그래 그래 그래 그래
1,나는 누구일까요
1,햇볕에 오래 있으면 어지러워요
1,덜컹덜컹덜컹 덜덜덜덜덜덜 갑자기 로켓이 흔들리더니
1,아빠 곰은 뚱뚱해
1,이름야 침대도 있어 엄마 여기서 누워서 자면 좋겠다 그지
1,그런데 호랑이가 도망가기는 커녕
1,음 글쎄 세윤이가 한번 궁리해서 만들어 봐
1,그거 갖고 어디 가
1,응 소꿉장
1,이름야 딸기 어때
1,어딨어 이거
1,어 엄마 제가 약 발라드릴게요
1,엄마의 난소랑 아빠의 정자랑 이게 딱
1,슝 슝 슝
1,여우가 도망을 가요
1,자기의 물건을 아끼고 사랑하는 마음이 더 중요하지
1,여기 있나
1,여기 올라가 봐 영 차
1,야 이리로 이렇게 역주행 하면 다쳐
1,이사람 누 구예요
1,이 아빠 토끼 어떻게 울고 있어
1,식빵이 없는데
1,똑바로 말해야지
1,어디 먹어 보자
1,어느 게 작어
1,어느 꽃 위에 앉아 있을까 예주가 붙여 보세요
1,또 바닷가에 있는 통통통통통통 하는 것도
1,간지럽혀야지 간지럽혀야지 아야 아야
1,짜자잔 봄이 되면 수컷과 암컷은 물 속에서 짝짓기 해 갖고 어 뽀글뽀끌뽀글뽀글
1,그래 엄마가 운전운전 열심히 운전해서요
1,여기 앉을까 여기 앉고 싶어서 그러지 너 짠
1,아풍 그녀는 호랑이와 암사자에게 불 굴렁쇠를 뛰어 넘으라고 하지요
1,응 응
1,하나 둘 하나 둘 줄을 맞추어서 가요
1,네가 알아맞춰봐
1,황금 날개 화물 회사 트레일러 트럭이네
1,개구리는 어떻게 울어
1,이거 어디 있어
1,아휴 지루해 이제 그만
1,까망이는 놓지도 않네
1,잘 몰라
1,어 기름이 여기 들어있는 거야
1,자 세윤이 꺼 뒤집어
1,그러니까 만지면 망가지니까 만지면 안 돼요
1,아이 뭘 그렇게 접어
1,프리도 어디 있는지 찾을 수 있을까
1,어디로 가 엄마가
1,엄마는 호비를 꼭 껴안아 주었어요
1,자 곰돌아 읽어보자
1,열어봐 뭐가 있을까
1,오 손 들고 있어
1,아빠 손가락이 간지름이 떨려요 색종이도 나도 신이 나서 떠들었습니다
1,너무 큰 목소리로 말할 수는 없지만 저는 도둑이에요
1,무궁화 꽃이 피었습니다
1,우와 맞았다 또
1,아니야 아니야 아니야 아니야 아니야 아니야 아니야 아니야 아니야
1,아이고 잘 하네
1,어 엄마 해요 어
1,으 으 으 으
1,그냥 갖고 있는 거에요
1,이 책 읽을까 이렇게 이거 이렇게 두고 이거 읽을까
1,우와 신기하다
1,응 자 이번에 자전거
1,지금 웃는다
1,여기 앉을까 여기
1,종현이가 보세요
1,당장 그만두지 못하겠니 모모
1,아빠는 티비를 보시고 우람이는 양치질을 했어요
1,우와 이거는 크레인이라고 그러는 거야
1,자 또 해 봐
1,뭐 할까
1,뼈는 뭐를 만드냐면은 우리 몸에 있는 피를 만든대
1,근데 도깨비는 매일 매일 할아버지 집에 놀러왔어
1,토끼는 그리고 빨리 가지 껑충껑충 뛰어서 가지
1,자 이거 다 읽었으니까 우리 이제 이거 마저 또 읽자
1,어 토끼있네 토끼
1,자 요기 뭐 놓냐
1,여기 기린도 있고요
1,응 유치원 옷 입고 있지
1,여기 풀장도 있고
1,얘는 양
1,무서운 멍멍
1,응 물안경 이렇게 끼고 물 속에 머리를 싹 집어넣는 거야
1,이렇게 나누면 피자가
1,우는 소리로 엄마 막 이러면 돼 안 돼
1,달님 여깄네 달님 안녕
1,보세요 오늘도 토끼가 찾아왔어요
1,이거는 아저씨들이 위급한 상황에서 가는 경찰차
1,아휴 시끄러워
1,우와 다 봤다
1,오 우와
1,야 그걸 줏어 먹고 있 니
1,예뻤어 안 예뻤어
1,어 거기 멍멍이 있잖아 강아지는
1,예주랑 할머니랑 정리해 놨잖아 그렇지
1,쉭 우와
1,자동차는 종류가 정말 많아요
1,앗 얘는 뭐하니
1,어 어
1,어흥 사자
1,짠 이게 뭐에요
1,침 안 맞아도 될 것 같애
1,그래 운석이 떨어져서 엄마가 그 이유를 설명해 주고 있잖아
1,응 우리 여기 앉아서
1,다시 크게 말해 봐
1,자 다음
1,어 초록색 종이 비행기가 있네
1,이거 먹는 거 뭐에요 딸기
1,만세 그새 많이 갖고 놀았네
1,아이고 천천히 가요 아저씨
1,초콜릿은 어린 아이들이 먹는 거야 얌냠냠냠
1,들어봐 짠 달팽이 집이다
1,예주 언제 케익 먹었었어
1,그러면은 프리도가 물에 안 떠내려가서
1,종현이 엄마가 무슨 책 보여줄까
1,대장으로 가서는 물을 빼
1,놀이공원에는 볼 것도 많고 탈 것도 많아요
1,아 거기는 붙어도 돼
1,너는 애랑 놀고 있어 오빠는 영희의 인형을 집어들고 내밀었습니다
1,이건 뭐예요
1,쓰리 투 원 발사 푸쉬 하고 하늘에 올라 가지요
1,똥 나오고 오줌 나와
1,둥드르둥둥 둥둥둥 둥두르둥둥 둥두르둥둥 특특특 해 봐
1,어 엄마
1,닦아줄께 싹싹 닦아줬네요
1,할머니가 뭐라 그랬어
1,빙글빙글 빙글빙글 돌아가요
1,책이 이렇게 많아 우리 종현이는
1,이거 뭐야
1,맛있게 드세요 암냠냠냠냠냠
1,그 다음에 음 빨리 하자 지원아
1,보글보글 쓱싹쓱싹 머리도 감구요 기분이 좋아서 당근이 더 맛있어요
1,두 개 먹고 세 개
1,할아버지 아 휩 짭짭 아 맛있다
1,얘 누구니
1,글쎄 왜 그래요
1,장난하고 있네
1,자 예주야 이게 뭐에요
1,곰돌이가 점점 약을 올렸어요
1,그래 종현아 친구들이랑 어떻게 놀아야 돼요
1,문이 열려야 아픈 사람을 싣잖아 구급차에
1,그거 아직 어렵다고 했다
1,작지만 날쌘 생쥐를 할 거야
1,캄캄한데 딱 들어가잖아 어디서 나왔어
1,연결된 걸로 봤어
1,어 후해가지고 뭐 먹어
1,아취 아취 아취
1,꼬마 토끼가 바뀌었어요 트릭씨 꼬마 토끼가 아니래
1,그리고 집중력 있죠 예
1,이거 바퀴 몇 개 있어
1,응 사자가 몇 마리야
1,해마다 여름이면 루이네 가족은 바닷가에서 지내요
1,그건 호랑이
1,얘 맘마 많이 먹는다 지원이도 맘마 먹으까
1,우와 되게 재미있겠다
1,그럼 우리 저쪽 가서 놀을까 놀까
1,혀 내미는 소리 이렇게 내밀었는 데 그치
1,예주는 이것 중에 어느 걸로 먹고 싶어요
1,악어가 바나나를 먹어
1,물고기를 좋아하나 봐
1,자 악어와 토끼가 무엇을 하나 붙여보세요
1,응 멍멍 하지
1,비행기 막 내릴 때
1,계속 한다고
1,응 응 그래 대신에 이제 그런 사이다 콜라 많이 마시면 안 돼
1,그러니까 너 입술을 막 빨아 먹으면 안 돼
1,할아버지가 옛다 이 녀석아 엄마 말씀 잘 듣고 이 인형 가지고 재미있게 놀아라 붙여주었네
1,이 기계에 가는 건가 봐
1,빵 타고 갔어
1,책 가지고 오세요 재미있는 책 가지고 오세요 엄마랑 책 봐요
1,따르릉 전화가 울리네요 누구일까요
1,일루 갖구 와 봐
1,여기론 어떻게 보이나 볼까 어떻게 보여
1,아삐가 뭐니
1,어 이거 해피 같은데
1,붕 여기 통과했어
1,자 이름가 먹어 봐
1,응 꿀순이 거기도 있어 응
1,웬디와 동생들이 잠에서 깼어요
1,여기 내부가 어떻게 생겼는지 굉장히 궁금해 하네요
1,바퀴가 하낫 둘 셋 넷 다섯 여섯 우와 많은데
1,걸레 주께
1,으응 그래 그래
1,찐 똘똘이고 엄마 심통이고
1,자 농구공
1,그거는 뭐야
1,하나야 왜 그래 하나야 어디 아파
1,우유 어저께 우유 먹는다고 그랬잖아 고양이
1,이거 읽고 또 다른 것 보자
1,잘 가
1,그래 화장실 가서 똥 싸야지
1,찐 척척
1,콧물 나오네
1,그러면 여우가 쫙 뜨는 거야 이렇게
1,흑흑흑흑흑흑 이름이가 날 안 좋아하는구나
1,한껏 들뜬 만수 엄마가 할머니와 순옥이의 손을 잡아 끌었어
1,이거는 원래 아가 타는 건데 아가한테 너무 작으니까
1,그런데 어떻게 다르게 줘야 할까
1,어떤 맘맘이야
1,그래 그래 고마워
1,예주야 똑바로 읽어 일어서서
1,옛날에 익룡이 없었다 똑 같은 상상일거 같은데
1,아빠 선물이야
1,찐이 철 오빠 이뻐
1,탐험가들이 동굴에 가 보았더니 우와 동굴 안이 아주 신기해요
1,그럼 여우는
1,왼발 들어
1,자 엄마 지갑도 자
1,난 배가 참 좋아
1,이이 이이
1,할머니도 아퍼
1,휙 누구야
1,이거는 엄마 시곈가
1,종현이도 팬티 많지 그렇지
1,아빠 가래
1,이리와 바짝 앉아 의자를 똑바로 이렇게 하고
1,여기 앉으세요
1,그러구 또 뭐 샀어
1,아무리 막 열심히 왔다 갔다 해도 녹았어 안 녹았어
1,오르니토미무스에요 이빨이 없대 곤충이나 공룡의 알을 먹고 살았대
1,이게 언니
1,이거 놀랬어요
1,이름인 뭐 할까
1,통나무를 하나로 줄여 봐 그러면은 들 수 있지 않을까
1,여기에다 붙여 주면 되겠네
1,응 잡아 당겼죠
1,바다 할아버지는 인자한 목소리로 다시 출렁였지요
1,새해 복 많이 받으세요 하는 거에요
1,코끼리 뭐하고 있어요
1,저기 있는 따라오세요 표시는 아빠 돼지한테 하는 말이 아니잖아요
1,응 하나 둘 셋 넷 다섯
1,요 요기 빠졌어
1,눈 가리고 웃고 난리네
1,엄마는 이거 큰 포도 먹을래
1,자 우리 예주 재미있는 애기 동화책 읽어봐요
1,너구리가 콧노래를 부르며 산길을 가요
1,고기도 있네
1,자전거가 나갑니다
1,고슴도치는 위협을 느끼는 고슴도치는 둥글게 몸을 말아 몇 시간 동안 이렇게 꼼짝하지 않고 있을 수 있데
1,컵 쌓기 할 사 람
1,여기 똑같은 모양끼리 해 볼 거야
1,종현이 맛있는 거 먹었어
1,이거 노리모노 책 볼까
1,종현이가 떼어 봐 엉덩이에
1,어 먹어 알았어
1,빠뿡이 책 읽어줄게
1,아가 해 보까
1,빨간 별도 달아야지
1,안 닦아
1,어디 있어
1,이게 새는 색깔이 어때요 무슨 색깔이야
1,자 우리 코스모스 가을에 가서 본 적 있는데 이것하고 똑같이 생긴 꽃 찾아서 붙여줄까요
1,안 돼 거기에는 독이 들어있어
1,세상에 저렇게 응가도 잘 눠요
1,일본 여기 있네
1,아주 작은 소리도 안나요
1,응 응
1,이래 가지고
1,으응 그럼 토치까까 줄께
1,응 알았어
1,저 저기 장난감으로 갑시다
1,종현이 선생님한테 화분 감사합니다 고맙습니다 선물 해 줬지
1,도 랄랄 랄라
1,스크루지 할아버지는 사람들을 쫒아내고
1,지금 얘네들이 뭐하고 있어
1,아 열기구 나라
1,얘가 누구야
1,여기 있잖아 이거 이거 뭐에요 이거 뭐야
1,밖에 나가고 싶어
1,아 여깄다 그지 그렇지
1,아휴 잘 하네 그렇게 울었지요
1,엄마가 이 둘 중에 두 개 봐봐
1,곰들도 싸우는 것 같지만 이렇게 장난 치는 거라네
1,어머 엄마는 몰랐네
1,하지만 난 어떻게 해야 할 지 몰랐어요
1,어디서 소리가 났지
1,쪼끔 이렇게 하라고
1,바나나도 붙여
1,노래도 있었지
1,해 봐 여기
