Label,Sentence
0,그런 것도 있을까 직업들도 있을까
0,이제 그거를
0,그 온라인 쇼핑도 자주 하세요 
0,잘 되고 마음이 맞을 수밖에 없는 거 같아 
0,라일락이라는 노래 
0,전국체전이 있었거든 서울에서
0,환경 오염 부분이 문제도 있을 테고
0,근데 김선호 그 터졌잖아 
0,확실히 규정을
0,그러니까 나는 그런 친구도 몇 명이 있어야 된다고 생각을 해 
0,근데 그날 엄청 빡셌어 
0,당근마켓에서 유용하 뭐 쓰면은 유용하고 뭐 그런 게 있지 
0,너무 이제 애들끼리만 노니까
0,무계획으로 가는데
0,그런데 사실 이런 합리적인
0,근데 갑자기 아 옷도 안 사고 싶고
0,그렇지 두 달
0,이제 오늘은 노래방 가자 
0,아 그 거기까지
0,내가 취직을 할 때 회사도 나를 평가해서 나를 선택하지만
0,연애는 이제 자기 상대방의 마음이 식으면은
0,어 그랬는데
0,난 좀
0,쫌 아냐 
0,오늘은 먼저 갈게요 하고 간 적도 있어 
0,긍정적인 면을 더 부각시키고 부정적인 면은
0,너무 사생활이다 
0,아 맞다 맞다 맞다 
0,대체하긴 힘들 것 같다고 생각을 했어 
0,좀 어떤 운동을 해 보고 싶어 
0,그런 부분에 있어서 사람들이
0,좀 듣는 경향이 있어 
0,나는 신발
0,터졌을 때 위험성이 크니까
0,들어가기 위해서 뭐 시험 치는 엔시에스 같은 것도 준비를 많이 해야 되고
0,구운 거 훈제 
0,그냥 만약에
0,어 그러니까 예쁘다고 하면서 근데 또 그거에 대해서
0,내 친구들도 거의 뭐 보건계열이나
0,그렇게 되면은 그때는 어떻게 할 건지 생각이 궁금해 
0,그럼 또 다른 스포츠라는
0,태양광이나 이런 부분도
0,이 감정이 들어가는 거에 있어서는 에이아이가
0,그 대중교통 타고 오잖아 
0,그리고 거기에 가전제품도 많다고 하는데
0,그 노래 뮤직비디오랑
0,좀 이제 편식을 좀 줄여야 될 그런
0,뭐 미술적인 것들을 그려내고
0,아 어떤 느낌인지 알겠다 근데 그거 진짜 좋은 방법인 거 같아 
0,어 이게 청바지 이쁜 거지 
0,어 근데
0,이제 안락사 근데 좀 약간 사람 생명이
0,어려운 문제지만 인제
0,그러니까 일부러 죽인 거는 아니잖아요 
0,나 맨날 친구들 오라 그래 랑
0,대중교통 타는 사람들한테
0,이 사람은 뭘 얘기를 해야지 막 그
0,그들의 막 분위기
0,음 뭔가 둘 다 만나면
0,근데 그것이 어떻게 해서 생겼냐면
0,가장 커 
0,그리고 그것도 있어 특수컬
0, 대 초반인데 뭘 걱정을 하세요 
0,이렇게 신나는 댄스 곡이나 이런 것들은 좀 어려우니까
0,갱년기를 바라보고 있는데
0,그치 모텔에서도 자라고 주기는 했는데
0,했는데 저 못 내렸다고 하니까 다음에서 내려서
0,청약 넣었는데 
0,사실 나는 우울할 때
0,그러니까 예를 들어 가지고
0,평소 평상시에도 그냥 카톡으로 너무 이야기를
0,정장을 입고
0,하지만 서로의 고충을 잘 알지 않을까 
0,어 자기 딱 몸이 예뻤지 
0,뭐 이쪽 관련된 일을 하고 있고 지금 무슨 일을 하고 있다라고 애들이 자신감 있게
0,그래서 나는 사실
0,억울한 마음이 들더라고 
0,안 할 순 없으니까 만 원짜리로
0,근데 가격이 가장 싼 날은 사실
0,미시적으로 개개인이 무엇을 준비한다고 해서
0,나도 어떻게 해 본 적이 없으니까
0,꼭 자격증 필요한 데를 갈 필요 없는 거고
0,그리고 막 누군지 궁금하지가 않아 갖고 가 그냥 아 그래 그랬대 
0,있 일어날지 안 일어날지 조차 모르는
0,그냥 결혼식 하니까 바로 생각났다고
0,뭐가 있는 가문들 있잖아
0,찬성보단 반대가 나은 거 같아 
0,좀 일찍 가는 걸 선호하는 편이라서 차라리 그 약속 시간에
0, 처음 먹었었을 때 보통은 뭐
0,너는 위탁을 했었다 했잖아 그럼 위탁 생활을 어땠어 
0,또 제가 잠을 잘 못 자는데 수면 체크랑
0,요리 잘하면 좋긴 하지 
0,개인적으로 하는 일이라면 누군가의 봉사가 봉사나 헌신이 필요할 텐데
0,아 진짜 
0,그러고 젊은 애들도 또
0,코로나 때문에 운영 안하다보니까
0,미안 기억나는 게 지금 없긴 한데
0,그래서 원에 되게 좋게 이용할 수 있다고 생각해
0,이때 드라마 중에
0,그럼 내 생각에는
0,그래서 내가 그거를
0,그런 거는 당연히 창의성 있고 그런 활동들은 에이아이에 맡길 수 없다고 생각을 해 어쨌든
0,음악대학교 같은 경우에는 이제 음악에 대한
0,있지 신곡은 제목 뭐야 
0,물론 주차를 할 필요는 없지 
0,이제 그럴 때는
0,그 지금 그리고
0,나 친구가 있는데
0,먹는 즐거움이 엄청 큰 거 큰데 사실
0,그러니까 가정을 먼저 생각해야지 가정에 맞춰서 그래서 일을 찾아야지 
0,그런 쪽으로 항상 얘기를 해서 채를 더 사야 된다
0,학습 아이들의 학습적인 부분도 그런 부분들을
0,그러게 그 수가 적어질 수는 있다고는 생각은 드는데 완벽하게 대체를 할 수 있을지는 아직
0,유튜브 보면서 하는 사람들 많다고 하더라 
0, 호선 신림에서 오빠랑 같이 있을 때
0,좀 안전하게 준비를 하고 있 있습니다 
0,기차를 엄청나게 많이 탈 수 있잖아 
0,아니야 버스 서서 갈 때도 많은데 
0,한 년이 됐나
0,네가 이력서를 잘 썼나 보다 
0,그거 타고
0,우리 회사 같이 다니는 어떤 나랑 동갑인 여자애가
0,사람들에게 구매를 유도하는 그런 식인데
0,같이 참여를 할 수 있도록 하고
0, 시에 일어나는 걸로
0,꽤 많이 들어있어서 좋았던 거 같아 
0,그런 시간들이 그러니까 어쨌든 자기 시간으로 남는 거니까 그 시간에 자기가 공 그 자격증 공부를 할 수도 있고
0,여러 종류의 여자애들
0,누워 있는 사람도 말만 못 할 뿐
0,비행기표 빼고 이면은
0,그런 부분도 무시 못한다라는 거죠 
0,잘 알지도 못하지만
0,싹 싸면은 저렴하면은
0,맞아 나도 나도 멀미 엄청 심해서 버스 못 타 너도
0,병고가 병정고가 되게 쎄다는 걸 바로
0,그런 데 가서도 하면은 텃밭 같은 것도 가꾸고
0,수입도 있고
0,배드민턴 한번 같이
0,희망을 얻거든 
0,랩들 래퍼들 다 이상하잖아 근데 
0,이렇게 인제 좀 많이 사 오는 편이에요 그러면
0,뭐 씻기
0,주변의 눈초리를 받으면서 까지 그렇게
0,알려 준 거 말고는
0,요새 날이 더워 가지고 잘 안 타고 
0,유명한 것들 있잖아 
0,그래서 요즘에는 쇼핑이라고 하면
0,그 동그랗게 생긴 거 그거에 왜
0,어 시키고 나서 먹고
0,칠리소슨데 좀 더 약간
0,뭐 내가 요번에 여자친구랑 부산을 갔다 왔을 때는
0,그러니까 완전 거기다가 하루 다 써야 되잖아 
0,고민 말하면은 공감보다는 현실적인 조언 많이 해 주잖아 
0,물 물건도 아니고 뭐
0,어쨌든 그 사이트 기사를 믿을 거 아니야
0,난 대학 생활에서 그렇게 힘든 건 없었는데
0,내가 알고 있던 음악의 이미지가 새로
0,그 뭐 인터넷 방송 같은데 보면은 밑에
0,그런 거 입으면은 밑에 이렇게 푹 퍼져 가지고
0,그런 일이 터지고 나서
0,택시 한 번 타면 돈이 너무 나가니까 근데
0,비행기도 많이 안 다니고 그러니까
0,거기서 여기까지 걸어와야 돼 
0,시간마다 딱딱 이동 하신 지 모르겠지만
0,어 홍천 홍천이랑 강릉도 이왕이면
0,그 나라만의 특색적인 되게
0,뭐 그럼 버릴 거 아니야 그래서 인제
0,지금 나이 제한 없이
0,많이 가게 되는 곳인데 그것에 비해서 성대역 가는 것이 너무 불편한 것 같아 
0,어 맞지 
0,양궁도 괜찮겠다 진짜
0,교수님이 일만 안 벌리시면 괜찮은데 자꾸 일을 벌리시고 이렇게
0,아 맞아 맞아 맞아 
0,그렇지 않니 친구야 
0,연봉이 되게 높거나
0,해결되는 거 같지 않아 어쨌든
0,이게 배운다는 게 처음 인제 가서 인제
0,뭐 이런 식으로 보조식품 같은 것 뭐
0,그런 데를 한번 가보고 싶다는 생각이 들어 
0,내 주장은
0,그래서 배송도 너무 느리고
0,라고 생각하는 거 같아 
0,그리고 그 어
0,키우고 싶고 너희한 어 먼저
0,타고 가야 되는데 거기까지가 우리가 또
0,한 공연에 모든 스토리를 볼 수 있게 하는데
0,그러니깐 누구 만나는 것도 솔직히 조심스럽기는 해요 
0,둘러 주면 되게 귀여울 거 같아 
0,뭐 우리 같이 뭐
0,좋을 거 같아 
0,바람직한 행동까진 아니지만
0,하고 있지
0,많이 올랐잖아 
0,거 봐 차 안 맡길 거잖아 
0,잘만 잡으면 박 일로 둘러보고 올 수도 있으니까
0,틀에 박힌 삶
0,차근차근 미리미리 준비해야 돼 
0,그때 생각을 하면
0,안 그래 
0,좀 더 넓은 방에서 편하게 쉬는
0,뭔가 할 수 있을 때 내가 할 수 있을 만큼은 최선한 모습을 좀 보여 드려야 되지 않을까 
0,다른 데로 빠져나가기 괜찮은 거라면 나가도 좋지만
0,어 애들도 좀 보고 한번 그렇게 볼 수 있는 어
0,이제 나쁜 점 좋은 점 이렇게 있겠지만
0,그 내려 가지고 다른 데 가서 부산 그
0,정해인은 너무 예뻐
0,근데 그 친구는 아무래도 결혼을 했으니까 남편이랑 많이 먹으러 다니겠겠지 
0,어 생각을 해 볼 수 있을 것 같아 
0,아직도 팔 생각이 있나 봐 난 솔직히 안 팔았으면 좋겠는데
0,회를 먹을 거면은 그쪽으로 
0,삼 과목 합격했구나 이 생각했지 
0,가장 기본적으로 알 수 있는 게
0,기차는 날 여행지로 데리고 가 그렇기 때문에 둘이 전혀 달라 
0,그 익혀 가지고 인제 다른 요리를 해 먹잖아 그러니까 그거는
0,어 근데 그러면
0,그거는 조작 아니지 않을까 생각이 들어 
0,역이 다 정해져 있고 뭐
0,아 이 형도 날 좋아하니까 이 형도 나 편하겠지 
0,이제 감독으로서 자격을 주겠다라고 했는데
0,아 나는 뭐 트러블이 있었기도 하지만 뭐 잘 푸는 성격이라서
0,축하한다고 연락 와가지고
0,아 소아과는
0,더 따지는 사회에서는
0,바리스타 비하 발언이라고 해야 되나 약간 이런 게 있어 가지고
0,그래서 그것이 되게 부족해 가지고 맨날 평소에도 누워 있고 해서
0,내가 전문대를 졸업을 하면 내 전문대 학점이 인정이 되긴 해 
0,나는 막
0,근데 이제 확대되면서 에스엔에스가
0,무시를 해버리는 걸 엄청 견제하고 있거든 
0,그래서 내가 물어보니까
0,그러면은 진짜 궁금한 게 있는데 
0,아 한 달씩 있나 보네 
0,밖에 조금만 데리고 나가도
0,검색해서 봐 봐 진짜 잘해 
0,약간 이런 감정 반이랑
0,사람들이 그건 좀 아니지 않아 하는 것 때문에 되게 놓쳤던 게 많거든 어릴 때
0,어디야 천안인가 
0,유명 맛집 해서 막 가는 그런 거에 나왔던 집이래 
0,많이 보고 공부도 하게 됐는데
0, 년은 배우고
0,발라드 멀리 하고
0,근데 이제 잠결에 와중에도 잠이
0,이게 그렇게 좀
0,맛있는 음식들이 많대 
0,얼마 전에는
0,지금 집을 보러 다니는데
0,그렇게 가족과 뭔가 얘기하면서 자연 풍경도 이렇게 둘러보고
0,별로 믿음직스럽지 않아
0,그래서 나는 되게 피 피일 줄 알았는데
0,그게 거짓일 수도 있지만 그 당시에는 기자도
0,넘었나 굉장히 하지만
0,맞아 그렇긴 한데 뭐 그래도 얘기 소재가 될 수 있는 게
0,나는 이제 야구도 갔다 와 봤고
0,고 의 투표는
0,여기에서 전단지를 돌리지 말아라 
0,강의를 재탕하는 경우가 좀 많더라고
0,부부의 세계 또 정리해 놓은 영상이 또 떴더라고 
0,마지막에는 확실하게
0,나는 거 김경호 따라한다고 머리도 막 엄청
0,필요가 있다고 생각합니다 
0,또 우리는 우리끼리 잘 맞는 그런 부류들이 있고 해서
0,어머니를 못 모시고 가는 경우도 있잖아 
0,그런 것도 참 좋을 거 같아 
0,비교할 수 없다고 생각해
0,그래서 처음엔 맛있는데 막
0,음악 교육을 그러면
0,이미지상 그건 맞지가 않지 
0,그 내가 그
0,서핑보드가 제일 재밌는 거 같아
0,색깔이나 약간 비슷한 거를 올리브영 가 가지고 찾은 다음에
0,한 달이 늦네 
0,나는 진짜 뮤지컬을 배웠어 
0,인터넷을 조금 찾아봤다 왜냐하면
0,봐야 될 거 같아 
0,음악이 굉장히 사람을 편안하게 해 주는 목소리라
0,월 수익 천 순수익으로 한 정도 나온다고 하더라고 
0,약간 좀 그런 불편함이 있지 아니 그러니까 지하철은 약간 그런 불편함이 있지 
0,많이 먹는 거 같더라 눈 영양제 이런 것도 많이 먹고
0,성심당 빵 사 오고 거기 성심당 빵 맛있더라
0,정확하게 누구 나오고 이런 거를 몰라서
0,지금 외국인 노동자를 해서도 안 되는 경우가 있어요 
0,카페인 없는 음료를
0,그래 가자 
0,밖에 나가는 게 제약도 있고
0,그 숲 가운데 있다는 게 
0,하단에 있는 데가 거의 다
0,그 공짜 그 이모티콘 그것 때문에
0,아이폰이 더 좋은 거 같아 갤럭시보단
0,만약에 옷을 사거나 이제 가방을 사거나 이렇게
0,그 그냥 다 어려워 이디엠
0,하지만 저는 이거는 그냥 서울시에서 눈 감고 그냥
0,구매를 하셨지 
0,일자리가 생기지 않을까 
0,사람은 생각하기 때문에 인지를 하고 있기 때문에
0,끓을 거고 해충이 생길 거고 그러면 그 모기들이며
0,현금 뭐 한 만 원을 낼 거 같아 아니면은
0,위에 걸칠 거나
0,보면은 이제 영양 교사도 있고
0,아 그렇구나 
0,드라마를 별로 좋아하진 않는데
0,그 맞아 체르노빌 사건에 관련된 그런
0,그리고 갑자기 차선에서
0,그럴 수도 있겠네 
0,그런 거는
0,처했을때 변해가는
0,그런 것도 그런 것만의 매력이 있어서 약간
0,그래 가지고
0,다정다감하게 좀 해 봐 그러면은 아빠가
0,그걸 예방 한다고는 하지만
0,여러 명이서
0,포도만 하더라도 포도 중에서 새로 나온 종류 있잖아 
0,다치거나 막 이런 것도 알아야 되고
0,욕심은 별로 없어서
0,나중에 다시 해요 
0,자 그러면
0,거기서도 공장 하나 짓고
0,어 나는 이제 이 우리나라에 원자력 발전소가
0,나는 거기는 기억이 안 나는데 많이 
0,이제 엔터에서의 경력을 좀 인정해 줄 만한 좀 유니크한
0,근데 그랬잖아 내가
0,앞에서 막 진행을 하진 않아 하지만 진행을 한 얘가
0,이런 친구들까지 어떻게 내가 커버를 칠 수 있나
0,그 가게가 안 돼서 어차피 없어진 거고 생각해 보면
0,밤낮없이 근무를 하기 때문에 
0,나도 그 부분에 있어서 동의하는 부분이 있어 너무
0,법이 그냥 이거를 못 따라가 버리는 거 같아
0,어 시댁에 가는 일이 큰 문제가 되지 않는 거 같아서
0,신기하네 다음에 시간 되면 한 번 봐야겠다 
0,그럼 겉에 걸쳐야지 까만색 자켓이든
0,어 그런 것 같아 
0,혹시 뭐 그런 강연 같은 거나 막
0,진짜 싫어 
0,해야 되는 그런 교육들도 요즘은 이제
0,일단 컴퓨터 공학과 자체가
0,그렇게 음식 취향이 안 맞는 모임은 힘들더라고 맛있는 거 먹으러 여행 가는 것도 큰데
0,매우 높아야되고 연료 확보의 환경 의존성이
0,그 도핑 왜
0,갔어 근데 보통 요즘에는 노쇼가 많아서
0,동네 산책하고 온다고
0,애초에 현금을 들고 다니질 않아서 생각을 못 해서 내가 그런 것일 수도 있고 
0,진짜 처음 이제 음악
0,나는 버스를 좀 좋아하는 편이거든 지하철은 아무래도
0,유행에도 확실히 더
0,요즘 환갑은 잔치는 안 하고 그냥 소소하게 가족들끼리 보통 모이잖아 
0,마음으로 자꾸만 나쁘게 마음이 삐뚤어져요 
0,가방도 사고 싶고 니트도 사고 싶고
0,그냥 너 하고 싶은 대로 다 해라 그냥 이런 데
0,비즈니스석 타고
0,그럼 다른 사람들이 많이 알 거고
0,뭐 사람 우리 다들 한 번씩은 다 그런 생각
0,서양 사회에서는 일단은
0,근데 그 친구가 힘든 걸 너도 알아 
0,그런 그런 거 같아 좀
0,근데 중국 같은 데를 보면은 어때
0,이야기를 해 주신 적이 있었잖아 
0,그래 안 그래 
0,나는 그렇게 생각한다 
0,색깔 막 핑크색 하늘색 이런 것만 사 갖고
0,연장을 하지 않았어 
0,어 나는
0,속상해 억울해 
0,단톡방 같은 곳에서 파티원 구한다고 하잖아 
0,어차피 옷 받쳐 입을 거면 비슷한 색상
0,좋았어 나도
0,근데 이제 반찬 같은 걸 엄마는 이제 그
0,아 이 일어나 있었나 잠깐
0,너는 그러면 그 적금 비중을 늘릴 생각은 없는 거지 
0,아까 네가 얘기한 것처럼 자전거도 너무 위험해 가지고
0,퍼 나를 수 있는
0,언론 쪽에서도 보면은
0,너무 좋더라구
0,우리나라가 지금 폐암이 윈데
0,근데 거기서
0,남문까지 와야 되잖아 남문 버스 정류장까지
0,어디 여기 다쳤는데 병원비가
0,그런 운동 응 걷기 되게 좋고
0,도와주고 가셨구나 딱
0,그렇다고 해서 내가 너희가 인 이상
0,경제든 정치든 세계
0,나는 전기 차 처음 타 봤어 
0,들고 비라는 곳에서는 그 에이 에서 먹은 시간 때문에 비를 제대로 못 봐
0,그러니까 여성분들이 특히나 이제 뼈들이 금방 약해지니까
0,결혼하고 나서 난소암이 발견돼서 자녀가 없이
0,그런데 그렇게 동거를 해 버리고 나면 사실 결혼한거나 다를 바가 없잖아 
0,그래 그래 그게 다 연습이지 준비고 
0,이제 이불도 그렇고
0,방화동이었나 강서구 쪽에
0,얼마나 됐는데 
0,그럼 당연히
0,근데 요즘 아 어 생각하듯이
0,그거 이제 사면서 같이 이제 그때 봐 가지고
0,그런데 보통
0,가까운 근교나
0,나는 뭐 한 번씩 즐겨 듣고
0,약간 많이 쉬었다가 해야 되다 보니까 좀 힘들더라고 
0,충분히 그런 쪽으로는 이미 울 우울증 환자들을 위해서
0,예를 들어 갈치나 뭐 고등어나
0,강아지하고 고양이 중에 하나를 골라야 돼 만약에
0,왜냐하면 그분들은 이미 좀
0,나 혼자 이렇게 좀 생각을 많이 했었던 거 같아 그리고 이제 와 보니까
0,지난번에 인스타그램에서 보니까 안젤리나 졸리랑 마동석이랑 포옹하는 영상이 있더라고 
0,세마역이야 오산대역 앞이 
0,이게 그러니까 여행이라는 게
0,이렇게 숨만 붙어서 의식도 없이 숨만 붙어서 깔딱깔딱 하면서
0,지분 얘기는 해 봤어 
0,뭐 일을 하든 안 하든
0,나 시에 수업 끝나고 너 시에 수업 끝나니깐 같이 밥 먹자 
0,그 저기
0,반대 하는 거에 대해선 좀 내가 그 사람 그런
0,집중도가 많이 떨어지는 거 같아 
0,맞아 거기 좋았어 거기서 나룻배 타고
0,아 제일 많이 들어지더라고 
0,그냥 귀여우니까 키우게 되는 거고
0,어 좋지 어 
0,운전해서 갈 수 있는 거리에
0,가서 만약에 내가 뭔가를
0,이제 단계를 하고 있는데 그것은 또 밥 세 숟가락만 먹게 하더라고요 
0,그래도 이렇게 옛날에는 막 크게 하는 게 부의 상징처럼
0,해야 되나 
0,그거 맞게 도착을 했는데
0,응 지분 잘 나눠 가지고
0,근데 뭐
0,뛰어다녀서 힘든 것보다 이제
0,말 먹거리
0,빠지 맞나 
0,소고기 인제 기름기 없는 거를 그냥 살짝 구워 먹는 거는
0,근데 씨랑 여보야랑 동갑이죠 
0,버스는 이제 사람 많으면은
0, 는 이 그 연도에 나와선 나온 연도에 이름이 붙잖아 
0,인스타 그 팔로우 많이 했잖아
0,그리고 또
0,어디까지 할 생각이야 
0,나는 당연히
0,징벌적인 것까지는 굳이 필요 없을거 같아 
0,나도 약간 내향적인 사람들이랑
0,뭐 전철 타고 그냥 맛있는 음식이나 인제
0,오히려 동반 입대을 했다가
0,자전거도 같이 잘 타지 
0,그 여자와 손잡이가
0,그렇지 약간 외국에서 살다온 사람은
0,그 아이들이 학교에 갔을 때
0,근데 언제 시작하는 지는
0,이렇게 하는데
0,근데 한테 얘기를 들으니까 목요일부터 된다고 금요일부턴가 된다고 하더라고 
0,그 샘 라이더라는 사람이 있어
0,곁에 두시고 계시는 거 같아요 
0,손해더라고 그 보니까
0,친구라는 그런 거를 더 돈독하게 해주는
0,진취적인 성향이라든지
0,해서 신상품을 하면 어떨까라고 네가 먼저 말을 했잖아 
0,그런 것들이 정말 불합리하다고 생각을 하거든 
0,교통편을 잡는 것도 일이다 보니까 저번에도 우리는
0,미국 나는 미국 주식을 직접 투자한 적이 한 번도 없거든
0,해 보니까 제가 적성에 맞는 건 쪽인 거 같아요 
0,그걸 처음에 음원으로만 들었어
0,뭐 연극 공연 뭐
0,쪼그려 앉거나 아니면은 좀 앉아 있어야 되는 자세들이 많잖아 
0,드라마를 찍을 때 여러 가지 그 콘텐츠의 힘에 대해서
0,거기서 보면은 요즘 애들이 또 그런 걸 많이 하다 보니까
0,일본어 일본어한 게 들어가서
0,그냥 기자들도 정확하게 알아 보지 않고
0,오히려 더 어려워지는 게 아닌가라고 생각해
0,그거 때문에 스트레스 받는 것도 난 적지 않을 거라 생각을 해 
0,근데 지금 상황이 심각해 가지고
0,그렇게 됐을 때는 나는 더 무서운 삶을 산다라고 생각을 해 
0,그 샤넬 매장
0,그래서 맨날
0,어 다시 그 꿈을 이룰 거야 아니면 그냥 그때도
0,그런 상황 자체를 만들지 않고 또 뭐
0,제니 좋아하지 
0,내 생각에는
0,사랑하고 이제
0,나는 취업 스터디 같은 게 더 중요한 줄 알았는데
0,맞아 그 아기였던 아이들이 다 이제 어른이 돼서
0,점점 안 보게 된다고 해야 되나 
0,날씨가 좀 쌀쌀해져서
0,나중에 학년 돼서
0,그렇게 컸습니다 
0,심각한 문제가 있는 거 같아 
0,그리고 왜 안 늙지 
0,몬스타엑스 미국판 
0,모르겠어 우정이란 게
0,집에 엘리베이터 타고 내려가서 지하에서
0,어 인권이라는 거를
0,익산 토박이였기 때문에
0,뭐 경사는 모르지만
0,요즘 뭐
0,오 이게 범죄에 쓰일 수도 있지 않을까 
0,딱 봐도 그럴 거 같아
0, 너한테도 연락했다 했거든 
0,그거에 대한 설문조사에 결과를 난 너한테
0,아니야 거기 아니야 
0,어 음악
0,돌반지 이제 이런 것들 다 시작이고
0,그냥 중저가 폰으로 해서 좀 그냥
0,예전에 한 번 가 보긴 했는데
0,좀 재밌게 보고 있는 프로그램이기도 하고
0,그런 거 살리기도 또 마땅치가 않고
0,부조금 받는 게 우선이기 때문에 그런 데서
0,요즘에 좀 코르나 때문에 대중교통 타는 게 좀 많이
0,대응을 할 시간이 필요한 거 같은데
0,비 대느라고
0,근데 다시 태어나도 지금의 가족과 같이 살고 싶은가라는
0,그러고 싶지가 않은 거야 나는
0,들어 놓아 놓으면 좀 나중에
0,그때는 주식 시장도 좋았고
0,그래서 나는
0,그냥 계속 러닝머신만 걸은 거야 
0,생각이 나더라 
0,막 냄새를 맡으면서 돌아다니는 거 같기는 하는데
0,봄 되면 한번 시작을 해 보자고 
0,애초에 명품을 있는 애가 없어서 그냥 어
0,거부했던 분이세요 
0,그렇게 얘기를 했기 때문에
0,코로나 시대이기도 하고 스마트폰을 이용해야할 일이 훨씬 많은 거 같은데
0,내가 결혼하고 싶은 여자라면
0,남들의 특히 걔한테는 안 질 거야 
0,그러니까 에스지 워너비의
0,너는 혹시
0,그런 좀
0,별로 없었잖아 
0,그랬던 거 같아 
0,왜냐하면은 일단
0,나는 쪼금
0,엄마 우리 옛날에 진짜 옛날에 우리 말레이시아 갔을 때
0,아 과연 저걸 저렇게 꼭 의식적으로 꼭 그거를 해야 되나 
0,대중적인 음악에서는 뭐 최근에 들은 곡
0,거는 어떻게 생각하는지 
0,나도 그거에는 동감을 하는데 가
0,인간이 할 수 있는 일이 없어지게 돼 
0,주위에 보면 
0,지켜보면서 하는 일
0,도 확실히 중요한 마케팅 전략
0,그럴 수도 있고 
0,버티고 이겨 나가고 아프니까
0,인제 덕화는
0,할아버지는 별로 안 좋으신 거 같아 
0,근데 그럴 때 뭘 어떻게 할 수가 없으니까
0,그래 가지고
0,성격은 진짜 착하잖아요 
0,좀 끔찍했던 것 같기도 하고
0,이 문화가
0,오션월드나 캐리비안베이 여기 또 들어갈 수 있는 게 난 굉장히 좀 오 모순
0,발견을 하는 거 같아 
0,그렇게 생각하고
0,그냥 한 두 곳만 정해 놓고
0,어 나는 맛있는 밥을 한번 사야 되겠네 
0,너는 졸업 했으면 좀
0,사장님 밑에서 같이 강습도 나가고 그런 식으로 계속 하고 있어 
0,근처로 가는 게 좋지 않아 
0,그때 월 말쯤이었잖아 어찌 보면은 근데
0,그런 차원에서
0,반대라고 생각을 해
0,우리는 이모
0,할아버지가 있다고 하셨는데
0,적어도 이제는 조의금을 해야겠지 
