Label,Sentence
0,내가 애니메이션을 그렇게 좋아하진 않아서
0,뭐 그런 거를 판단을 하려면은
0,한 번
0,나의 착각이었더라고 
0,으 그런 그러니까 비대면으로 인해서
0,그런 것도 있고 아니면 진짜 뭐
0,그게 내가 시간이 없어가지고 보고는 싶은데 그리고 요즘에 그게 너무 인기다 보니까 엄마 아빠가 같이 보고 싶다고 하는 거야 
0,대체할 수 있는 거 같아 
0,초등학생 가르치는 그런 것을 했지만
0,그렇지 그랬지 그리고 뭐 수학여행 
0,뭐 공부할 때나 노래를 들으면은 노래가 꽤 생각나더라고 
0,그래도 구기종목이 그나마 낫긴 할 것 같긴 해 
0,그 생각조차도 안 했으니까 
0,돈 없어도 괜찮을 거 같은 게
0,비대면을 하는 것도 정말 괜찮다고 생각합니다 
0,기피 시설이 들어오는 것에
0,왜 울산은
0,그런 지 기 기후 변화 그리고 지구 온난화가 굉장히
0,아직도 기억나 
0,작은 부분에 좀 신경을 써 줘라 이렇게 늘 걔 편만 들었는데 
0,있고 없고를 떠나서 누가 어
0,생산하는 전기량을 봤을 때 그리고 오염도를 봤을 때
0,그러네 뭐 선별적으로
0,그 좀 생각을 해 봐야 되지 않을까
0,들을 거면 완전히 그렇게 하거나 그랬으면 좋겠어 그리고
0,막 수행평가나 그런 거 할 때는 핸드폰이 안 빠져
0,뭐 장기이식이든 의료비용 부담이든
0,여행업 하면서 달려왔잖아 언니
0,내가 그 안철수 관련 주식을 샀잖아 
0,이제 그런 부분으로 인해서 이제 막
0,너무 삭막하게 만들진 않을까 
0,근데 요즘은 기준이 어떻게 되는지 알아 
0,어 가 되게 힘들어했어 
0,그게 내 입장이 된다면
0,아이 안 그래도 부엌 한번 뜯어 고치고 싶었는데
0, 천만 원인가
0,한 달 동안 돈까스 먹어라 하면 먹을 수 있을 것 같아 
0,그렇지 아무래도
0,이제 헤어졌어 근데 내가 그때 머리가 진짜 길었잖아 고 때
0,또 나도 나중에 가서 볼 수 있으니까 너무 재밌는 거야 
0,그렇게 하면
0,음식점 만들 때 프랜차이즈 문제랑도 약간 비슷한 거거든
0,나도 이제
0,응 그때 그 예비군 대상으로 그
0,근데 이제 애들 성격을 보면은
0,그런 좌석 버스가 대부분은
0,좀 낭만 있다 
0,같이 또 갈 수 있는
0,아파트 현관도 그렇고
0,그러니까 한정된 지역에서만 사용할 수 있는 게
0,심지어 그렇게 해서 데리고 온 것만 해도 수십 마리가 됐었어 
0,사람들이 없는 곳에 있어야 되는 게 맞는 것 같아 
0,자기들끼리 한 번 짜 보라 그러고 그렇게 일정대로
0,데려 오면 되게 이쁘겠다 
0,그것만 듣고 
0,그런 거를
0,아니면은 근처 막 마실 같은데 
0,막 이르고 그런 게 전혀 없어 
0,나도 그 사람이 아니라 잘 모르겠는데
0,밑에 있는 고양이들은
0,그렇지 퇴근도
0,게임 게임이 더
0,다른 트로트 내일은 국민가수 하는 트로트
0,그걸 반길 수 있어 
0,내용에 대해서 잘 아니까
0,나도 원래 멜론 쓰다가 그 실시간 차트 짜증 나 가지고
0,내가 남녀공학이라
0,이렇게 잘 접하지 않다 보니까
0,정말 이상은 선생님
0,묻혀서 가는 거지 막
0,아 집에 있으면서 그거 확실히 느꼈어 재료의
0,현재 레퍼토리로는
0,근데 또 어떻게 생각하면
0,근데 이는 추석 때
0,하면 아무래도 생 생활하는데는 쪼금은 불편함은 있겠지만
0,맞아 맞아 나도 그래서 약간 별로 안 좋아하는 게 있는 거 같아 
0,나는 그래도 좋다고 느낀 점은 뭐냐면
0,근데 지금 비대면이니까 너도나도 에이를 준다는 거야 교수가
0,요즘 이런 막 기사나 이런 것들도 보면은
0,이후에는 어쨌든 공간이 부족하니까
0,반대를 해 
0,부여를 갔다 온다든가 이 화상도로를 타고
0, 번 안 탄 지가 년이 넘어가는데 
0,맨투맨 어 어쨌든 막 인터넷에서 찾아봐도
0,근데 이제 나초같은 경우는 이제
0,야 근데 또
0,안 돼 안 돼 안 돼 
0,어 신문에서 본 것 같은데 시시 티브이가 많이
0,약간 좀 결단적인 생각을 내려야 될 거 같다고 생각해 
0,그런 게 많이 좀
0,전 괜찮다고 생각을 해요 
0,온 뭐야 
0,그래서 아이들하고 부모하고 모두가 합의 하에
0,봐서 그런지
0,근데 생리가 터진 거야 
0,이걸 또 한 번 하면 열 줄은 싸야 되는데 열 줄 정도 먹을 수도 없고 하니까
0,아 슬랙스도 사야 돼 
0,만들어 나가려고 노력하다 보면은
0,같이 전송 올라간다 
0,자기의 생각이 들어 가고
0,백예린 약간 그런 노래 많잖아 음원 없고 그냥 유명한 노래들
0,힘들지 이제는
0,어 근데 저는
0,그 우리 찾아본 것 말고 홈쇼핑이나 인터넷에서 좀 더 찾아봐 가지고
0,어 저희가 인제 대중음악만 얘길 했는데 사실은 음악의 종류는 굉장히 많잖아요
0,어 있다고 생각하는데
0,뭔가 이제 직접적으로
0,우리 부부를
0,뭘 젤 먼저 받
0,시시 티브이를 말하는 거라면
0,그거 야구팀이었어 
0,그렇지 원래 그래서 가수들도 다
0,가사도 되게 자유롭고
0,좋은 것 같아 
0,멀리 가지 내가 일본이랑
0,아이 근데 난 솔직히 아이패드 사길 바랐는데 
0,다른 것은 다 안 보고 그냥 디자인만 이쁘면 그냥 사 버리는 것 같아 
0,우리 그 물 진창 있는 그런 그 진흙에
0,그래 그러면 다행히 이제 이가 공부하는 이제
0,그래서 이제 그런 로봇 일로 인해서
0,사람이 되게 많은 시간
0,아 세 명에 선생님 한 명이니까 
0,술과 잘 어우러질 수 있는 그런 조합이기 때문에
0,이게 나는 아직 우리나라의 이 문화라든지 사회가
0,중학교랑 고등학교 막 다 걸어서 다닐
0,그래서 그냥 꾸준히 이어 온 거 같아요 
0,근데 뭔가 월급을 받으면서 계속 회사에서 살면은
0,근데 그 거기만 그런 거고
0,근데 너도 괜찮다 그러고
0,커트를 해 
0,시간 내기 어려우니깐 뭐 주말에
0,그걸 보고 바로
0,그러니까 너무 힘든 거 같아 차리는 사람과 그
0,자기가 능력이 되기 때문에
0,좀 그런 거 같아 너무 옷이
0,어 많이 받으면 많이 받을수록 좋지만
0,어쨌든 오늘 이제 일찍 자고
0,다른 방송들도 나오긴 나왔는데 
0,그 꾸준히 전에 같으면 공부를 하느라고
0,잘 되어 있을 거라고 생각을 해서
0,예 그
0,근데 문제는 또
0,아주 좋은 기회로 어 기업의 스카우트 당했을 때
0,정말 그 감정들을 받았던 것들을
0,음 뭔가 둘 다 만나면
0,그런 거 그런 걸로 인해서 조금 우정이
0,보통 격주로 하잖아 다른 학교 근데 우리는
0, 이가 하는 말이 엄마는 그거 왜 자꾸 들어요 이러는 거라
0,너무너무 맛있더라고 
0,여기서 일찍 출발하니까
0,어 어 
0,걔네 둘은 워낙 오래 사귀었고 서로 좋아하는데 
0,이렇게 되는 건데
0,보여 줘야 한다고
0,그 그게 좋다고 해서 그거 챙겨 먹고 있거든 
0,그래서 요가원
0,좋겠다 주변에 제주도 갔다 온 친구들도 많고
0,근데 지붕 뚫고 하이킥은 많이 봤거든 
0,첫 출근에 지하철을 잘 못 타가지고
0,내가 엘지꺼 봤는데 그렇게 요즘에는 많이 저렴해졌더라고
0,진짜 그걸 보면서 되게 깜짝 놀랐어 쓰면 또 따로 결정이 되는 거지 
0,박팸 애들이
0,힘들었지만 엄마 아빠의 기대에 되게
0,시험 봤던 얘기 들어 보면
0,바꿀 것 다 바꿨고
0,타고는 싶어 타고 싶은데
0,엘리베이터를 타야 되고 계단을 내려가야 되고
0,그래서 혼나서
0,그 베리 베리 해치우려고 
0,풀 리그 
0,요즘에 오마이걸 최신곡인 이제 던던댄스를 많이 듣고 있는데
0,이게 생각보다 범죄율도 진짜 많이 줄었어 
0,아 근데 너 이번에 그
0,그때 한 번 역류성 식도염 때문에 고생했다고 했던 말 기억하나 
0,같이 훈련 막 하고 그러는데
0,괜찮지 않을까 싶어 왜냐하면 아무런
0,이동하면 되겠다 그게 더 나을 거 같아 
0,왜냐하면 빗질을 해도 엄청 많이 나오는 게 고양이고
0,격주도 아니야 우린 그냥 대면이야 
0,아이들이 어 이가 이사 가고 싶지 않다고 이야기 하더라고요 
0,채소 같은 거는 상하게 되고
0,이렇게 나처럼 그냥 명절 때나 엄마 아빠 생일 그리고 또 뭐 휴가 이럴 때 본집 가서 있는 것도 난 괜찮다고 생각하거든 근데 물론
0,그 고춧가루가 그러니까 함부로 어 함부로
0,근데 그것도 하나의
0,부산에서 무료로 하는 거 알아봐 주셔서 나보고
0,그런 거는 애저녁에 없었지 
0,그거 할 때부터
0,그 언니가 누구야 
0,정확한 시간에 정확하게 지하철을 이제
0,미래의 어느 정도 미래까지 여행을 하는 거야 
0,그 노래가
0,워커 워커홀릭 스타일은 아니어서
0,최근에 나는
0,성향을 아니까는 같이 가서
0,제한적인 게 많으니까
0,창문도 계속 열어놓고 그것도 다 켜 놨는데
0,아니 그건 아니고
0,거기 샐러드도 팔아 
0,그냥 가끔은 허례허식같이 느껴지기도 해서
0,넷플릭스 보고
0,음악을 들으면서
0,그 수시로 시시 티브이로 감시하셔서 지시를 하신 적이 있었어
0,택시는 무서운 거야라고 있어 근데 나도
0,혹시 너는 알아 
0,모친상 이런 데를 대표로 갔었거든 근데
0,나중에 우리가 훈 혼수 
0,군대 생활 이어나가면서
0,어 그런 데가 있었어 
0,내가 스물네살이기는 하지만
0,줄이는 것은 쇼핑이랑 관계 없잖아 
0,당연히 해운대지 
0,그래도 일단 자유롭게 풀되
0,주변에 아는 사람도 없어서
0,어 무조건 또 싼 게 좋은 건 아닌 거 같아 
0,햄스터 같은 경우에는
0,저 사람이 진짜 이런 걸 원하는구나하는 대답을 좀
0,문제가 생겼을 때 이게 처리 해 주는 거나
0,사당역으로 와서
0,이게 이렇게 빨리 온다 싶은 그런 거에 또 쾌감도 있는 거 같고
0, 개월 동안 아무 일도 안 하고 화면만 쳐다본단 말이야 
0,그렇게 되는 거는 아닌 거 같아 
0,인간과 인간과의 관계에서 내가 가장 중요하다고 생각하는 것은 바로 진정성이다 다름 아닌 진정성 진실 진정성
0,그렇지 긋
0,어 제주도 말고는 해외를 나가고 싶은데
0,여러 명에서 만나잖아 
0,사실 노인들 보면은 살찐 사람 아무도 없잖아요 
0,어렸을 때
0,강아지들도 유기된 애들 보면 불쌍해 
0,이제 지하철에만 국한된 게 아니라
0,지켜야 할 것들이 있잖아 
0,애초에 안 가 
0,집 수원인가 
0, 시간에 한 번씩 그런 게 있다더라고 
0,너무 고통스럽고 힘들고 그러니까 이루어지는 거니까
0,빠지 맞나 
0,어느 날은 오빠가 그랬어 나한테 
0,그래서 우리가 아직 안고 가야 될 문제 같아
0,그 뭐라 그러지 미세하게 쪼금씩 맛
0,그걸 갖다가 처벌한다는 거는 좀
0,돌려서 유튜브 보는 게
0,좀 그런가 
0,가르칠 수 있는
0,근데 나는 아직까지 잘 모르겠긴 해
0,뭘 해야겠다 이렇게
0,외국 분들이랑 확실히 한국 분들에
0,예전에 다니던 학교가
0,그 피해 받는 사람이
0,어 건강식품 개수가
0,조율이 잘 돼서
0,우유를 넣어서 하면은
0,나는 아기가 있으니까 아기를 챙겨야 되고
0,면이 좀 있거든 그러니까
0,나는 집안 행사가 좀 많았으면
0,어 그런 것도 있잖아 
0,또 네 내 머릿속에도 지금 맴도는 거 같아 
0,근데 그랬어 누구 연예인 누가 그랬다 그랬지 
0,난 약간 그런 비용을 여행 비용으로 생각하기에는 좀 아깝다라는 생각이 좀 들어서
0,점점 자극적인 것들로만 방송을 편성 하려고 하는 거 같아 
0,들어가기 위해서 뭐 시험 치는 엔시에스 같은 것도 준비를 많이 해야 되고
0,어 오히려
0,이게 사실은 그래 보면서
0,추어탕 한 번도 안 먹으셨어요 
0,좋아서 그 노래들도
0,응 나는 그냥 아빠 차 아빠
0,근데 요금은 빨리 끊으면 빨리 끊을수록 싼데 이제
0,왜 어 
0,그런 거 같고 그래도 내가 생각했던 거는 교사가 되고 난 다음에 내 내가 관련된
0,음 그래서 나도 인제 옛날 생각하면 지금 현재
0,그래서 저는 집 근처에서 산책 많이 해요 
0,사람의 일자리를 뺏지 않을까 
0,그런 건 안 해 봤어 내가 그렇게 끈기있지가 않아요 
0,뭔가 재밌는지 잘 모르겠어 
0,남는 시간에 잠을 자야 되는데
0,그런 느낌이 조금
0,비싼 거 말고
0,버스 타고 또 지하철 갈아타고 항상 그렇게 해 
0,안 잔인했어 
0,계속 많이 하고 있습니다 
0,좀 완전 옛날 드라마인데 궁 알아 
0,이게 그런 로봇에 장점이 무엇인가면
0,너 친구들 중에 정시 준비하는 친구 있어 
0,그게 제일 좋은 거 같아 만나지 말고 그냥 여기서
0,음식을 안 하니까
0,나도 그러더라고
0,진짜 얼마 안 됐잖아요 
0,나에게 맞는 사이즈가 있었으면 좋겠어 
0, 층에서 걸어 내려오면 다리가 엄청 아프더라구 
0,초기에 설치 비용은 필요하지 
0,응 나도 우리가 수능이 끝난 지 얼마 안 됐잖아 
0,아쉬우니까 대학교 가서라도 최대한 많이 남기고 즐기고
0,뭐 이렇게 있는 건 아는데 예진인가
0,그냥 숙소 같았어 
0,그래 그럼 아이티엑스 타고 여행이나 가자 
0,중간중간 휴게실을 가긴 해 
0,한 대당 뭐 천만 원 이상
0,큰 개
0,이런 형태가 많은데 그게 주축인데
0,어 꼭 수녀관에만 머물러 있다고 해서 봉사를 밖에서 못 하는 건 아니잖아 
0,어 애들 만나 보긴 해야지 
0,돈을 투자할 만한 가치가 있는 거 같아 
0,깔 맞춤 그리고 뭐 노캔 기능
0,일단 거기 가서도 마스크 쓰고
0,어쨌든 근데 스마트폰을 이용해서 수업
0,나는 잘 그렇지가 못 해 
0,할아버진가 할머니가 그걸 좋아 하셨다고
0,그런가 봐 
0,확진자 수도 좀 적어지면서
0,나는 간식을 집에서 만들어 본 적은 없고
0,이게 핑계가 될 수 있지만
0,그래 가지고 친 칭 친한 사람은 
0,먼저 약속을 잡을려고 할 때
0,그런 댓글 하나하나에도 나는 좀
0,지금도 계속 알아보고 있는데 
0,그래서 나는 스키장 가면은 초심자 코스 아예 안 갔어 
0,좀 그래 갖고
0,라고 얘기 하려던 거 같아 
0,시간 보면 세 시 넘어가고 이런단 말이야 
0,음 나는 없는데
0,학과다 보니까
0,그런 데에서 살면 건강이 나빠지는데 일단 그런 데서 사람이 산다
0,어 에스케이지 
0, 학년이 아직 되기 전이니까
0,생각은 안 나 대기업 건 아니고 아무튼 우리
0,옛날 노래들이 돌아오는 거에 대해서
0,아 난 좋아 난 좋은 생각 같아
0,분명히 속마음은 착한 친구일 텐데
0,그래 그래서 이제 좀 변형시키거나
0,우리 가족끼리만 지내고
0,현찰만 쓰셔서 그런 건지 모르겠는데
0,그러니까 보통 취소표가 영화 한
0,언니 죽으면 어떡해요 
0,너네 집에서 떠들 수가 있나 
0,어떤 차별점이 있어서 뽑히는지는 잘 모르겠어 
0,방금 했던 말 자체가
0,테이프 테이프 들었어 학년 때 
0,같은 회사
0,근데 또 어떻게 생각하면은
0,어떻게보면 그냥
0,파비스보다는 스파캐슬이 더 나았던 것 같기도 하고요 
0,근데 또 겨울엔 춥잖아요 
0,스토리가 다 생각이 나는 편이야 
0,야 월에 제대했어 
0,단순 노동을 하는 기존의 노동자들이 굉장히 많은 양의
0,학습이나 본인의 사고의 발달이 충분히
0,뉴스가 다 가짜일 수는 없을 것 같아 유튜브 같은 거 보면은
0,즐겨 하지는 않게 되는 부분이 있고요 그리고 하고 싶은 게 원래는
0,내가 삶의 질의 스 측면에서는 중소기업이 좋지 않을까 
0,저 외국 사람들이 보기에는 또 저 우리나라 저 노숙자들이
0,나 모르는데
0,의견 절충안을 찾는 것도
0,구청에 가서
0,뭐 그거 말고도 그냥 뭐
0,문과 이과 학생들이 통합이 되다 보니까
0,그 음악 들으면서
0,일단은 아까 말씀한 부분이
0,이 생각을 했거든 
0,짜장면 같은 거
0,친구 결혼식은 가 본 적이 없어서
0,나는 그래서 더 좋다라고 하는 생각에 자꾸 내 생각에서는 드는데
0,그런 거가 뭔데 
0,그 사람의 성의가 보이면 그렇게 해 주면 되는 거고
0,그동안 지냈던 정으로 사는 게 아닐까 
0,맞아 국악도 사실 우리가
0,아니 에스케이티가
0,그 구멍을 뚫고 버려야 되는데 안
0,적당히 자기 양에 맞춰서 하는 게 제일 중요하다고 생각해 
0,우리 애가 계속 보 맹모삼천지교가 괜히 생긴 게 아니잖아 
0,같이 데리고 와서
0,꼬시는 거 같아서 안 하 안 보고 있어 
0,나는 일단은 사람이 최대한 안 있는 쪽으로
0,내 몸이 안 따라 주니까 할 수도 없고
0,할 줄 알았는데 그게
0,아 대학원은 내 인생
0,많이 이용하는 대중교통이 뭐야 
0,자기 전에 도 되게 이완되고 하는 것도
0,만났다고 했잖아
0,일을 하는 사람으로서 에이아이를 쓰는 게
0,찍고 다니는 애들도 있었잖아 
0,그렇게 여유 가질 수 있는 시간이 있을까 그 사람들한테 
0,그냥 팔뚝 이렇게 잡으면 튼 탄탄해서 다 근육인 줄 알고
0,정시에 출근해야 되고 퇴근하는 사람들에게는
0,오빠 그러고 보니까 오빠는 요즘 노래방에서 어떤 노래 들어 
0,오우 요새 현아 던 같이 신곡냈더라 
0,돈 아낄 수 있고 하니까 좋을 거 같아 
0,어떤 이제 뮤지컬 하는 홀이 있잖아요 
0,우리야 뭐
0,안 키웠으면 좋겠다는 생각이 들긴 해 
0,본인들이 뭐
0,통과할 수 있고 막 자유롭게 갈 수 있잖아 
0,좀 정신적으로 이상한 사람 본 거 같은데 
0,방해하는 느낌 
0,모르겠어 사실
0,그걸 나라 법으로 정하자는 얘기지 
0,제 친가에 있는 고양이는
0,나도 기분이 좋다 
0,현실적으로 나한테
0,원자력이 이
0,저희 영어 교재에도 그 내용이
0,응 아빠가 응
0,겨울용은 근데 너무
0,최소한 강아지 고양이 정도라
0,어린 애들이랑
0,미리 문 앞에 가 있어야 됐는데
0,응 그냥 우리 그런 것 있잖아 그냥 쓰고 싶은 것 
0,따지지를 못한 거지 
0,근데 아버지는 오히려 또 마르셔 갖고
0,그 통보하는 것도 나쁘지가 않다고 이렇게 생각해 
0,미스 트롯에 나오는 애 누구야 걔
0,이런 정치에 대한 뉴스가 그렇다지만
0,너는 제일 먼저 어디 가고 싶은데 
0,다이어트에 성공은 못 했어 
0,최대한 넣을 수 있는 대로 넣을 거 같아 
0,음 맞아요 이것이 어 전적으로 사실 선생님의 역량이 어떻게 수업을 하시는지가 드러나는 음
0,좀 정도가 심해 걔는 
0,그냥 뭐라 그럴까
0,그런 것도 자전거로 막 전국
0,차라리 내가 하 시간을 내서 천안 가서
0,우유 하나 가지고 사주라고 하기가 그렇잖아 
0,찬성을 해 
0,도심의 지금 밀집되어 있는 인구들이 거기로 분산되어서 내려갈 수 있는 효과도 같이 기대할 수가 있는 거잖아 
0,잔소리 비슷한 말을 하시지만 
0,낙으로 삶을 살아 갈까
0, 만원을 넘어갔던 적이 있어요 
0,랩들 래퍼들 다 이상하잖아 근데 
0,자녀가 수업 시간에 혹시 딴 짓을 하지는 않을지
0,사회에서 만나는 친구도
0,맞아 나도
0,그것도 아들한테 어느 정도는 약간
0,어쩔 수가 없어 그 부분에 대해서는 어느 정권이 들어오던 간에
0,아니 그런 친구 사귈 수 있겠지 근데 난 도저히 못 사귈 거 같아 
0,웅덩이가 너무 많아 가지고 비 오면 고여 있어 
0,거기서 촬영을 한다거나
0,빨리 이 알바 인생에서 벗어나고 싶다 
0,숙소를 예약을 하고
0,그러니까 돈이 안 든다 이거지 
0,그러니까 눈이 즐거워지는 거야 
0,피순대 먹어 봤어 
0,넌 혹시 웃긴 유튜버 아는 사람 있어 
0,도로 한가운데 이제 대중교통 그 전용 차선이 있는데
0,애 중에 춤을 진짜 잘 추는 애가 있거든요 그래서 자기가 춤을 잘 춘다 길래 예전에 이제 춤 췄던 영상을 나한테 보여 줬거든요 
0,같이 너도
0,안 쓰는 게 제일 편하긴 한데 근데 쓰고 다녀야 되는데
0,그럴 줄 알았다 많이 막 많이 막 먹더만은
0,근데 갑자기 아 옷도 안 사고 싶고
0,막 공무원
0,엄마는 사람 사는 얘기 되게 좋아하잖아 
0,아 그래
0,그 집이
0,원자력 자체를 반대를 하는 것은 이제 어쨌든 환경적인 문제가 많이 따라 오기 때문에
0,그래서 이제
0,순천이 괜찮다고 해서 순천
0,뭐 이거 재밌어라고 추천을 받아도
0,그래서 아직까지 진지하게 결혼 생각을 해본 적은 단 한 번도 없긴 하거든 
0,하 나도야 
0,어 변호를
0,정말 사람들마다 다 다른 거고
0,나는 거기 가면 이제 주는 나 나초 있잖아 처음에 나초 주는 거
0,소목장 같은 데 보면 배설
0,누구나 다 아 저 사람은 곧 죽을 건데 이것이 의미가 있을까라고 생각하던 시점에
0,응 응 
0,근데 내가 먼저 또 그렇다고 말을 잘 붙이는 편은 아니라서
0,그 뭐야 
0,나는 그러면은 부산에 와 가지고
0,엄마 친구 분 
0,청년 인턴을
0,그런 의견을 내가 내는 건 아니지만
0,나 응 
0,친정에만 왔다 갔다 해서 너무 편했는데
0,응 되게 잘 맞아 
0,맞아 왜냐면은 다 직장 가져 있고
0,우리 거 뭐
0,할아버지가 너무 일찍 돌아가셔 가지고
0,물론 공부도 요즘 인터넷을 많이 하는데 
0,그런 유명한 집을 제외하고
0,회사가 어떻게 해야지 잘 더 잘 굴러 갈 수 있을까
0,애들이 다 나 같은
0,이래 가지고 다 투지로 바꿨는데
0,응 응 
0,집도 와 걸어 왔다 갔다 하기가 인제
0,야외에서 결혼식
0,충분히 반영을 해서
0,이게 맛있다고 해서 내가 이걸 먹었잖아 
0,어 나이 먹어서 더 많이
0,같이 알아보고는 있어 
0,근데 아직까지 복잡한데 오늘 좀
0,제이인 것도
0,보건소에 일할 수도 있어
0,사모님이나 아내에게 선물을 해주기도 하잖아요 
0,우리 그럼 이따가 홍대 갈 때는
0,예전 파이브 
0,몇 번 모일 기회가 없잖아 
0,기간 제한은 없어 공기업은
0,그래 그 장면이 거의
0,성적을 올리라고 해 그러면 
0,거기서 이제 한 사람 거에 대해서 돈을 지불을 하고 
0,공기업 준비 포기하게 
0,그렇게 해 본 것들 때문에 지금은 후회가 없다 하더라고 
0,나중에 다시 얘기해 보자 
0,임영웅이 노래가 참 좋고
0,뭐 그날 오퍼 누구였냐 이런 거 찾아 보면 나올 텐데
0,뭔가 증거들을 조작하면서 까지 그런 가짜 뉴스를 하면
0,다정다감하게 좀 해 봐 그러면은 아빠가
0,버즈를 끼면은 웃을 때 자꾸 빠지더라고 귓구멍이 쪼끄마해지는지 
0,단지 이제 문제가 뭐냐면
0,여기 명치에 애송이 앉아 가지고
0,나도 항상 키우고 싶다고 한 생각하는데
0, 원 충전해서 여자 친구 보고 왔던 막 그랬던 적도 있는 것 같아 
0,법무사가 작성을 해도 되나 어쨌든 변호사는
0,갈 데는 이제 쪼금씩 줄어들고 쪼금씩이 아니지 많이 줄어들고 
0,그 어릴 적 친구 못지않게 챙겨 주는 사람들이 생기더라고 
0,기름값도 딱히 막 걱정 안 해도 됐었거든 그때 하이브리드 차여서
0,은 안 하는 거 같아 그냥 있는 거 찾아 보는 스타일
0,너무 큰 사업을 많이 해 갖고
0,그래서 내가 택배 안 뜯어 보는 이유가 그거랬잖아 떨려서 어 
0,그런 일이 있으시면 언제든지
0,요즘 얼굴 보기가 힘들어 
0,그 영화에서
0,근데 우리 엄마는 아이키 팬이여가지고 엄마는 아이키를 뽑겠다는 거야 훅을
0,그다음에 드라마 오에스티 이런 거 참 좋아했었는데 
0,어 대체하는 것도 필요하다고 생각해 그래서
0,그게 진짜 심각하지 않나
0,근데 이제 결혼을 해도
0,예상 대기 시간 이런 것들이 나오는데
0,찬성한다고 생각을 하게 됐어 너희들 말 듣고
0,엄청 맛있어 했잖아 
0,넣어서 한다고 막
0,집에 색깔별로 다 있다고 안 사도 된다는 거야 그래서 내가
0,아니야 있어 있어 봤어 
0,버스비가 한 원이었거든 그리고 지하철 또 왔다 갔다 하니까
0,약간 수위조절을 이렇게 하긴 해야 되는데 
0,흐르고 흘러 정말
0,나는 제주도랑
0,그런 게 이제 사람은 어차피 돌아가실 분인데 안락사
0,근데 가고 싶긴 하다 옛날에 거기 강원도 갔을 때 뭔가
0,아 진짜 
0,이익준 교수님 
0,또 환승 시스템이 복잡하기로 유명한데
0,내 강아지는 죽었지만 이 범퍼를 물어 줘야 되기 때문이야 
0,징벌적인 것까지는 굳이 필요 없을거 같아 
0,이제 먹으니까 
0,내 상황상 이렇게
0,일단 첫째는
0,그런 이렇게 방송하는 것도 지금
0,어떤 좋고 나쁨의 판단을
0,정말 힘이 되게 응 응 그런데 이제
